,author,dish,type,inglst,time_prep,time_cook,tags,ingredients,servings,rating_star,rating_num,meta_description
0,Katie Morford,Spring Vegetable Tortellini Soup with Pesto,vegetarian,"['onion', 'carrots', 'broth', 'tortellini', 'variety', 'peas', 'thirds', 'peas', 'woody', 'juice', 'herb', 'pesto']",20,15,"['healthy in a hurry', 'soup', 'freezer-friendly', 'quick and easy', 'healthy', 'vegetarian', 'tortellini']","1 tablespoon extra-virgin olive oil,1 medium onion, chopped,2 cloves garlic, chopped,1 cup sliced carrots,6 cups low-sodium vegetable broth,8 ounces fresh or frozen tortellini, any variety,1 cup snap peas, cut into thirds,1/2 cup fresh or frozen English peas,1 cup 3/4-inch pieces asparagus, woody ends removed,2 tablespoons fresh lemon juice,1 to 2 teaspoons kosher salt,Freshly cracked black pepper,1/3 cup herb pesto, either store-bought or ",4-6 servings,5,2.0,"This tasty tortellini soup is loaded with vegetables like asparagus and peas, and is topped with zesty pesto! It comes together in 35 minutes, start to finish. Use what’s on hand whether it's fresh, frozen, or from the pantry. "
1,Sara Bir,Instant Pot Mushroom Risotto,vegetarian,"['mushrooms', 'onion', 'rice', 'wine', 'miso', 'chicken', 'vegetable', 'parmesan']",10,45,"['family-friendly', 'instant pot', 'vegetarian', 'mushroom', 'risotto']","2 tablespoons extra virgin olive oil,1 pound mushrooms, washed, trimmed, and quartered or sliced,1 medium onion, finely diced,3 cloves garlic, minced,1/4 teaspoon salt or to taste,1/4 teaspoon freshly ground black pepper or to taste,2 cups Arborio or Carnaroli rice,1/2 cup dry white wine,2 teaspoons soy sauce,2 teaspoons miso paste (white or red),3 3/4 to 4 cups low-sodium chicken or vegetable stock, divided,2 tablespoons unsalted butter,1/2 cup finely shredded parmesan cheese, plus more to garnish,1/4 teaspoon lemon zest, optional","4 as a main dish, 6 as a side dish",5,2.0,"Easy weeknight mushroom risotto that’s special enough for occasions, too! The Instant Pot makes it fast, and fail-safe. Plus we have a hack that lets you time your dinner perfectly!"
2,Carrie Havranek,Vegetarian Pad Thai with Tofu,vegetarian,"['rice', 'tamarind', 'cayenne', 'vegetable', 'tofu', 'eggs', 'peanuts', 'sprouts', 'quarters', 'peanuts', 'pepper']",10,12,"['stir-fry', 'thai', 'noodles', 'tofu']","1 (14-ounce) package flat, wide ,2 to 3 teaspoons salt,3/4 cup rice vinegar,1 to 2 teaspoons tamarind , or ,1 cup granulated sugar,Pinch of paprika (or cayenne powder),10 to 12 tablespoons canola or vegetable oil, divided,1 pound tofu, extra firm, drained and cubed,4 large eggs,1/3 cup roasted, unsalted peanuts, chopped roughly,1 cup bean sprouts,1 lime, cut into quarters,2 tablespoons roasted, unsalted peanuts, chopped roughly,Chopped cilantro, for garnish,Red pepper flakes, for garnish",4 servings ,5,1.0,"Pad Thai goes vegetarian! Crispy pan-seared tofu is your protein, and salt takes the place of fish sauce for a vegetarian spin on this favorite takeout dish."
3,Erin Alderson,Buffalo Cauliflower Tacos with Ranch Sauce,vegetarian,"['bite', 'size', 'corn', 'tortillas', 'chives', 'avocado']",10,15,"['quick and easy', 'vegan', 'cauliflower', 'taco']","2 cups cauliflower, chopped into bite-size pieces,2 teaspoons neutral oil,Pinch of sea salt,2 tablespoons ,2 tablespoons ,4 8-inch corn tortillas, warmed,2 teaspoons minced fresh, flat-leaf parsley,2 teaspoons minced fresh chives,1 teaspoon minced fresh dill,1/4 teaspoon garlic powder,Pinch of salt,Pinch of pepper,1/4 cup ,1/2 avocado, diced,1 tablespoon chopped parsley, to garnish",2 servings (2 tacos each),5,1.0,"These Buffalo Cauliflower Tacos are a great meat-free main—all the flavor of buffalo wings, but made with cauliflower! Top these easy tacos with vegan ranch dressing and serve."
4,Sally Vargas,Black Rice Bowls with Tofu and Veggies,vegetarian,"['rice', 'miso', 'honey', 'block', 'tofu', 'spray', 'scallions', 'parts', 'rice', 'rice', 'rice', 'florets', 'cucumbers', 'kale', 'almonds', 'currants']",30,35,"['salad', 'healthy', 'vegan', 'rice', 'tofu']","1 piece (1-inch) fresh ginger, peeled and thinly sliced,1/2 clove garlic, thinly sliced,1/4 cup water,2 tablespoons rice vinegar,2 tablespoons red miso (See recipe note),1 tablespoon low-sodium soy sauce,1 tablespoon honey,1/4 cup olive oil,1 tablespoon toasted sesame oil,1 block (14 ounces) extra-firm tofu,Olive oil spray,3 scallions, white and light green parts, thinly sliced,1 cup black rice or forbidden rice,6 cups water,1 teaspoon salt,1 cup unseasoned rice vinegar,3 teaspoon salt, divided,2 tablespoons sugar,1/2 cup water,1/2 small head of cauliflower, cut into small florets,3 Persian (small) cucumbers,1 tablespoon low-sodium soy sauce,1 teaspoon sesame oil,1 bunch kale (any kind), washed, dried and stems removed,2 tablespoons olive oil,Salt to taste,Toasted almonds, for garnish,Cilantro leaves or Thai basil, for garnish,1/4 cup currants, for garnish",4 to 6 servings,5,1.0,"Infinitely versatile, these Black Rice Bowls with Tofu and Veggies with a miso dressing are SO GOOD! They make a satisfying lunch or dinner for vegans, vegetarians, and carnivores alike. "
5,Elise Bauer,Spicy Vegetarian Chili,vegetarian,"['onions', 'zucchini', 'bell', 'peppers', 'jalapeño', 'peppers', 'check', 'heat', 'jalapeños', 'hands', 'rub', 'eyes', 'plum', 'tomatoes', 'liquid', 'plum', 'tomatoes', 'chili', 'fennel', 'beans', 'kidney', 'beans', 'lemon', 'lemon', 'juice', 'beet', 'coconut', 'version', 'sub', 'aversion']",20,70,"['vegan', 'chili', 'chili beans']","1 1-pound (450g) eggplant, cut into 1-inch cubes,5 tablespoons extra virgin olive oil,2 yellow onions, chopped,3 cloves garlic, minced,2 medium zucchini, chopped,2 large red bell peppers, cored, seeded, diced,1 to 2 jalapeño peppers, seeded, finely minced (Taste and check the heat of the jalapeños. If very hot only use one, if mildly hot, use two. Wash hands with soap and water after handling. Do not rub eyes.),1 28-ounce (794g) can Italian plum tomatoes, coarsely chopped, including liquid (or 2 pounds fresh plum tomatoes, peeled and chopped),1 tablespoon ground cumin,1-2 tablespoons chili powder,2 tablespoons chopped fresh chopped oregano or 2 teaspoons dried,1 teaspoon fennel seeds,1 1/2 cup cooked white beans (1 15-ounce or 425g can), drained and rinsed,1 1/2 cup cooked kidney beans (1 15-ounce or 425g can), drained and rinsed,Zest of one lemon,3 Tbsp lemon juice,1 teaspoon sugar (use raw, beet, or coconut sugar for vegan version),1/3 cup chopped fresh cilantro (can sub parsley if you have an aversion to cilantro),Salt and freshly ground black pepper to taste",Serves 8 to 10,5,24.0,"The BEST Vegetarian Chili! Make it with eggplant, plum tomatoes, onion, garlic, zucchini, bell peppers, jalapeños, white beans, kidney beans, and cilantro. You won't miss the meat!"
6,Carrie Havranek,Valerie Brunmeier’s Cheesy Taco Pasta Skillet,pasta,"['chili', 'onion', 'pepper', 'beef', 'onion', 'flavor', 'fiesta', 'mix', 'chicken', 'broth', 'tomatoes', 'beans', 'mild', 'chiles', 'pasta', 'rotelli', 'corn', 'monterey', 'jack', 'cheese', 'cheddar', 'cheeses', 'olives', 'onions']",5,28,"['cookbooks', 'family-friendly', '1-pot', 'pasta and noodles']","1/4 cup chili powder,2 tablespoons ground cumin,2 teaspoons paprika,2 teaspoons finely ground sea salt,2 teaspoons freshly ground black pepper,1 teaspoon granulated garlic or garlic powder,1 teaspoon onion powder,1 teaspoon dried oregano,1/2 teaspoon red pepper flakes, or to taste (I used a pinch),1 pound lean ground beef,1/2 cup chopped onion,1 teaspoon minced garlic,2 tablespoons Flavor Fiesta Taco Seasoning Mix,2 cups low-sodium chicken broth,1 (14.5 ounce) can diced tomatoes, undrained,1 (8-ounce) can tomato sauce,1 (15.5-ounce) can black beans, drained and rinsed,1 (4-ounce) can mild diced green chiles,8 ounces uncooked short dry pasta like fusilli, rotelli, elbows or penne,1 cup frozen corn,1 cup shredded Monterey Jack cheese, divided,1 cup shredded cheddar cheeses, divided,1/4 cup sliced black olives,1/4 cup chopped cilantro,3 green onions, thinly sliced,Sour cream",6 servings,5,2.0,Tacos and pasta! Why didn't we put these two together before? This one-skillet dish full of Southwestern flavors and pasta comes together in a flash with pantry staples. Your new favorite weeknight go-to!
7,Elise Bauer,"Bowtie Pasta with Peas, Prosciutto, and Arugula",pasta,"['bowtie', 'pasta', 'prosciutto', 'thin', 'peas', 'baby', 'arugula']",15,15,"['dinner', 'favorite spring', 'italian', 'prosciutto']","1/2 pound (8 ounces) farfalle bowtie pasta,3 tablespoons extra virgin olive oil (divided, 1 Tbsp and 2 Tbsp),2 ounces prosciutto, thin slices separated and roughly chopped,1/2 cup fresh or frozen peas,1/2 cup shredded Parmesan cheese,1/2 teaspoon freshly ground black pepper,1 cup reserved pasta water,1 large handful baby arugula (about a cup and a half, packed),2 tablespoons thinly sliced fresh mint leaves",Serves 3 to 4,5,1.0,"A lighter version of bowtie pasta with peas and prosciutto, no cream, but instead tossed with Parmesan, olive oil, and arugula."
8,Elise Bauer,"Shrimp with Olives, Tomatoes, and Orzo",pasta,"['orzo', 'pasta', 'ripe', 'tomatoes', 'tomatoes', 'olives', 'capers', 'caper', 'juice', 'shrimp', 'baby', 'arugula']",10,25,"['dinner', 'lenten', 'quick and easy', 'seafood']","8 ounces orzo pasta,3 tablespoons extra virgin olive oil,3 cloves garlic, minced,1 pound ripe fresh tomatoes (about 4 medium tomatoes), chopped (about 3 cups),1 1/2 cups of chopped ripe black olives,2 tablespoons capers (including caper juice),1/2 teaspoon salt,1/2 teaspoon black pepper,1 pound medium to large raw shrimp, peeled and deveined,1 cup chopped fresh baby arugula (or 1/4 cup chopped fresh parsley)",Serves 4,5,3.0,"This Shrimp Orzo with Olives and Tomatoes is a perfect easy midweek dinner with shrimp, black olives, fresh tomatoes, capers, garlic, arugula, and orzo pasta."
9,Aaron Hutcherson,Chorizo-Stuffed Sweet Potatoes,pork,"['sweet', 'potatoes', 'bell', 'peppers', 'onion', 'chorizo', 'casings']",10,85,"['dinner', 'chorizo', 'sweet potatoes']","4 medium sweet potatoes,2 tablespoons vegetable oil,2 green or red bell peppers, sliced,1 medium yellow onion, sliced,1 1/2 teaspoons kosher salt,1/2 teaspoon chili powder,1 (14-ounce) package fresh chorizo, casings removed,Cotija cheese, for sprinkling, to taste,Chopped cilantro, for sprinkling, to taste",4 servings,,,"Check out these Chorizo-Stuffed Sweet Potatoes! That's right: Russets aren't the only potatoes worth stuffing! Here, we're stuffing roasted sweet potatoes with a mixture of spicy chorizo, tangy cotija cheese, peppers, and onions."
10,Sally Vargas,Pressure Cooker Lamb Stew with Spring Vegetables,lamb,"['lemon', 'peel', 'shallot', 'leeks', 'parts', 'lengthwise', 'wine', 'chicken', 'turnips', 'ends', 'peas', 'spinach']",10,40,"['dinner', 'pressure cooker', 'lamb']","2 sprigs rosemary,2 sprigs parsley,1 bay leaf,2 wide strips of lemon peel,2 pounds lamb, cut into 1 1/2 to 2 inch pieces,1 teaspoon salt,1/8 teaspoon pepper,2 tablespoons olive oil,1 large shallot, peeled and thinly sliced,2 medium leeks, trimmed tough green parts, halved lengthwise and thinly sliced,2 tablespoons all-purpose flour,1 cup dry white wine,1 cup chicken stock,3 to 4 small turnips (about 12 ounces), trimmed, scrubbed and cut into 4 wedges,1 pound asparagus, tough ends trimmed and cut on the diagonal into 1-inch pieces,2 cups frozen peas,2 handfuls baby spinach",4 to 6 Servings,,,"Leeks, peas, asparagus, turnips, and white wine turn this Pressure Cooker Lamb Stew into a spring event! "
11,Sally Vargas,Shrimp Cobb Salad with Creamy Basil Dressing,seafood,"['mayonnaise', 'yogurt', 'juice', 'honey', 'pepper', 'shell', 'shrimp', 'onion', 'peppercorns', 'heads', 'lettuce', 'crisp', 'pint', 'cherry', 'tomatoes', 'avocados', 'mangoes', 'cucumbers', 'cheese']",30,10,"['dinner', 'cobb salad', 'shrimp']","1/3 cup mayonnaise,1/3 cup plain Greek yogurt,1 tablespoon lemon juice,1/2 teaspoon honey,1/8 teaspoon salt,1/8 teaspoon pepper,1/2 cup packed basil leaves,1/3 cup olive oil,1 pound large (16-20 per pound), shell-on shrimp, thawed,1/2 yellow onion, sliced,2 bay leaves,1 teaspoon salt,1/2 teaspoon peppercorns,2 sprigs parsley,4 slices bacon, cut crosswise into slices,2 small heads baby romaine lettuce, or other crisp lettuce, torn into pieces,1 pint cherry tomatoes, halved,2 small avocados, sliced,2 small yellow mangoes, peeled and diced,2 Persian cucumbers, sliced,8 ounces cotija cheese, crumbled",4 Servings,5,2.0,Looking for a light and refreshing salad? Try this Shrimp Cobb Salad with a little tropical flair from mangoes and the salty bite of cotija cheese. 
12,Nick Evans,Bourbon BBQ Meatloaf,beef,"['onion', 'celery', 'bell', 'beef', 'eggs', 'breadcrumbs', 'bourbon', 'honey']",20,60,"['barbecue', 'meatloaf']","2 tablespoons olive oil,1 medium red or yellow onion, roughly chopped,1 medium carrot, roughly chopped,1 stalk celery, roughly chopped,1/4 red bell pepper, roughly chopped,3 cloves garlic,2 pounds ground beef (90/10 blend),1 tablespoon Worcestershire sauce,2 large eggs,1 cup breadcrumbs,1/4 cup fresh parsley, minced,2 teaspoons salt,1 cup BBQ sauce, , or store-bought (I like Stubb’s),1/4 cup bourbon,1 tablespoon brown sugar,1 tablespoon honey",6 servings ,5,6.0,Here's a new riff on classic meatloaf with bourbon BBQ glaze! The secret to tender meatloaf? Mince your veggies and give them a quick sauté before mixing them into the meatloaf. You'll love it!
13,Summer Miller,Easy Chicken Skillet Enchiladas,chicken,"['chicken', 'onion', 'mild', 'chilis', 'chili', 'taco', 'tortillas', 'radishes', 'avocado', 'jalapeño']",10,20,"['family-friendly', 'enchiladas']","8 ounces cooked chicken (about 2 cups shredded),1 teaspoon oil,1/4 yellow onion, minced (about 1/3 cup),3 cloves garlic,15-ounce can tomato sauce,1/3 cup water,4-ounce can mild green diced chilis,2 teaspoons chili powder,1 teaspoon oregano,1/2 teaspoon cumin,8 taco-sized flour tortillas,8 ounces cotija cheese,Cilantro,Radishes, thinly sliced,Sour cream,Avocado,Jalapeño",Serves 4 (2 enchiladas per person),5,2.0,These chicken skillet enchiladas are easy to make and ready in 30 minutes. They also use only one pan and are great to double and freeze for a meal down the road!
14,Andrea Nguyen,Chicken Curry with Sweet Potato and Lemongrass,chicken,"['stalks', 'onion', 'style', 'curry', 'coconut', 'milk', 'boneless', 'skinless', 'sweet', 'potatoes', 'orange', 'flesh']",15,40,"['1-pot', 'vietnamese', 'curry']","1/2 cup coarsely chopped lemongrass, from 2 medium stalks,2 tablespoons coarsely chopped peeled ginger,1 medium yellow onion, coarsely chopped,2 tablespoons Madras-style curry powder, preferably ,1/2 teaspoon freshly ground black pepper,1/4 teaspoon cayenne pepper, optional,1 (13.5-ounce) can full-fat, unsweetened coconut milk, ,2 tablespoons virgin coconut oil or neutral oil, such as canola,4 large boneless, skinless chicken thighs (about 1 3/4 pounds total), each cut into 3 pieces,1/2 teaspoon fine sea salt,1 1/4 pounds sweet potatoes (white or orange flesh), peeled and cut into 1-inch chunks,3 to 5 fresh cilantro sprigs, coarsely chopped",4 to 6 servings,5,6.0,"Chicken, lemongrass, and sweet potatoes on their own are pretty great, but when simmered in coconut milk and topped with chopped cilantro, they become pure magic in this Vietnamese Curry. "
15,Summer Miller,Creamy Chicken Soup,chicken,"['carrots', 'stalks', 'onion', 'bone', 'chicken', 'egg', 'noodles', 'beans', 'apple', 'cider', 'heavy']",20,45,"['family-friendly', 'soup and stew', 'comfort food', 'chicken soup']","2 tablespoons olive oil,6 large carrots, diced,4 celery stalks, diced,4 cloves garlic, minced,1/2 large onion, diced,1 teaspoon kosher salt,1/4 teaspoon freshly cracked black pepper,2 teaspoons dried thyme,1 bay leaf,8 cups chicken stock, store-bought or ,4 bone-in chicken thighs (about 1 1/2 pounds),8 ounces egg noodles,2 (14-ounce) cans cannellini beans,2 teaspoons apple cider vinegar,1/2 cup heavy cream,2 tablespoons chopped fresh parsley",8 servings,5,2.0,"This easy Creamy Chicken Noodle Soup skips the roux, cuts the cream, and gets a healthy protein and vitamin boost with the help of puréed cannellini beans. All of the flavor and creaminess, with none of the guilt! "
16,Aaron Hutcherson,Spicy Fried Chicken,chicken,"['buttermilk', 'cayenne', 'bone', 'skin', 'chicken', 'parts', 'flour', 'peanut']",10,30,"['dinner', 'deep fried', 'chicken', 'fried chicken']","2 cups buttermilk,1/2 cup hot sauce,1 teaspoon kosher salt,1 teaspoon ground black pepper,1 teaspoon cayenne pepper,1 teaspoon garlic powder,3 1/2 pounds bone-in, skin-on chicken parts,2 cups all-purpose flour,1 tablespoon ground black pepper,1 tablespoon cayenne pepper,2 teaspoons kosher salt,1 teaspoon garlic powder,Canola, vegetable, or peanut oil",4 servings,5,2.0,Ready for some seriously spicy fried chicken? Hot sauce in the buttermilk marinade and cayenne in the breading means you're headed toward seriously spicy bliss. 
17,Sally Vargas,"Skillet Chicken Thighs with Potatoes, Carrots, and Greens",chicken,"['bone', 'skin', 'chicken', 'yukon', 'gold', 'potatoes', 'carrots', 'break', 'chard', 'chicken', 'lemon', 'juice', 'lemon']",15,45,"['budget', 'skillet recipe', 'chicken thigh', 'potatoes']","8 (3 pounds) bone-in, skin-on, chicken thighs,1/2 teaspoon salt,1/8 teaspoon pepper,2 tablespoons olive oil,1 1/2 pounds (about 4 medium) Yukon Gold potatoes, cut into 1-inch chunks,12 ounces baby carrots,3 whole, unpeeled cloves garlic, smashed with the flat of a knife to break the skin,1 bunch Swiss chard,1 1/2 cups chicken stock,1 tablespoon Dijon mustard,Finely grated zest of 1 lemon,1/2 teaspoon dried thyme,Juice of 1/2 lemon,1/4 cup chopped parsley",4-6 servings,5,3.0,"Crispy skillet chicken is cooked in a flavorful lemon broth and served on a bed of Swiss chard, potatoes, and carrots. This bistro-style oven braised chicken with vegetables has everything you love about cozy comfort food. "
18,Marta Rivera,Chicken Cordon Bleu,chicken,"['flour', 'breadcrumbs', 'eggs', 'skinless', 'chicken', 'breasts', 'prosciutto', 'ham', 'cheese', 'sticks', 'lemon']",45,30,"['dinner', 'holiday', 'comfort food', 'chicken']","1 1/2 teaspoons kosher salt,1/2 teaspoon granulated garlic powder,1/4 teaspoon ground black pepper,3/4 cup all-purpose flour,1 1/2 cups panko or regular breadcrumbs,1 tablespoon chopped fresh parsley,2 large eggs, beaten,4 boneless, skinless chicken breasts (2 1/2 pounds), trimmed of excess fat,1 1/2 tablespoons Dijon mustard,8 slices (about 4 ounces) prosciutto or sliced ham,4 ounces Gruyere or Swiss cheese, cut into 1/2-inch thick sticks,3 cups vegetable oil, for frying,1 lemon, sliced into wedges",4 servings,,,"Impress your friends and family with Chicken Cordon Bleu! Thin chicken breast is topped with prosciutto and Swiss cheese, then rolled, breaded, pan-fried, and baked to crispy golden perfection. Dinner never tasted so good!"
19,Nick Evans,Chicken Freezer Burritos,chicken,"['grain', 'rice', 'lime', 'juice', 'peppers', 'onion', 'beans', 'chili', 'salsa', 'verde', 'colby', 'jack', 'burrito', 'tortillas', 'tortillas', 'jalapeños']",20,20,"['eat your food', 'family-friendly', 'freezer-friendly', 'make-ahead']","1 1/2 cups long grain white rice,1 lime, juice only,1/4 cup chopped cilantro,2 red or green peppers, sliced,1 yellow onion, sliced,2 tablespoons olive oil, divided,2 cups ,, shredded,2 (15-ounce) cans black beans, drained and rinsed,1/2 teaspoon salt,1 teaspoon chili powder,1 teaspoon ground cumin,1 cup salsa verde, store-bought or ,16 ounces grated colby jack cheese,8 large 12-inch burrito-sized flour tortillas OR 32 small 8-inch flour tortillas,2 ripe avocados,1/4 cup pickled jalapeños, chopped,2 tablespoons minced cilantro,Pinch of salt",Makes 8 large burritos or 32 small burritos,5,3.0,"Chicken Freezer Burritos are your answer to a quick, family-friendly weeknight meal! They're easy to make and delicious (when reheated correctly!). Here's everything you need to know about how to make freezer burritos you'll actually want to eat!"
20,Nick Evans,Grilled Chicken Under a Brick,chicken,"['chicken', 'zest']",15,25,"['dinner', 'grill', 'grilled chicken']","1 3-pound whole chicken,2 cloves garlic, minced,1 tablespoon fresh rosemary,1 tablespoon fresh thyme,1 lemon, zest only,1 teaspoon kosher salt,1 teaspoon ground black pepper,1/4 cup extra virgin olive oil",Serves 4,,,"Want to know the secret to crispy chicken skin? Grilled Chicken Under a Brick! No actual brick required, just something heavy. Get ready for weeknight chicken dinner perfection!"
21,Summer Miller,Chinese 5-Spice Skillet Chicken with Green Beans and Peppers,chicken,"['boneless', 'skinless', 'chicken', 'tenders', 'chicken', 'breasts', 'corns', 'spice', 'blend', 'orange', 'orange', 'juice', 'beans', 'orange', 'bell', 'onion', 'cracks', 'orange', 'optional']",17,32,"['freezer-friendly', 'low carb', 'chicken']","1 1/2 pounds boneless, skinless chicken tenders, tenderloin, or thinly sliced chicken breasts,1 teaspoon fennel seeds,1 teaspoon whole black peppercorns,1 bay leaf,1 teaspoon kosher salt,1/2 tablespoon brown sugar, packed,1 teaspoon Chinese 5-spice blend,Zest from 1 orange,3 tablespoons orange juice,2 teaspoons sesame oil,1 pound fresh green beans, washed and trimmed,1 large orange bell pepper,1/2 large onion,2 teaspoons soy sauce,3 or 4 cracks of freshly ground pepper,Orange zest for garnish (optional)",4 to 6,5,2.0,"Need dinner in a hurry? Chinese 5-Spice Skillet Dinner to the rescue! Lean protein, loads of colorful vegetables, and on the table in about 30 minutes!"
22,Nick Evans,Apple Cider Chicken Thighs with Sweet Potatoes,chicken,"['bone', 'skin', 'chicken', 'potatoes', 'onion', 'apple', 'cider', 'chicken']",10,50,"['eat your food', 'family-friendly', '1-pot', 'chicken']","4 or 5 bone-in skin-on chicken thighs (about 2 pounds),2 medium sweet potatoes, diced (about 2 cups diced),1/2 white onion, sliced thin,1/2 teaspoon kosher salt,1/2 teaspoon black pepper,1 cup apple cider,1/2 cup chicken stock,1 tablespoon fresh rosemary, or orzo for serving (optional)",Serves 4,5,1.0,"Want a perfect fall weeknight meal? These Apple Cider Chicken Thighs are it. Simmered in the oven with sweet potatoes and onions, it's a one-pot skillet dinner that'll fill you up without stressing you out."
23,Sally Vargas,"Tamale Pie with Chicken, Green Chiles, and Cheese",chicken,"['scallions', 'chiles', 'spray', 'skillet', 'corn', 'kernels', 'jack', 'cheese', 'chicken', 'salsa']",25,50,"['casserole', 'mexican and tex mex', 'rotisserie chicken']","3 cups ,2 3/4 cups hot water,4 tablespoons (2 oz) unsalted butter, at room temperature, cut into thick slices,1 cup (about 7 ounces) cold vegetable shortening,1 1/2 teaspoons salt,2 teaspoons baking powder,1 tablespoon olive oil,1 bunch scallions, thinly sliced,2 (4-ounce) cans of chopped green chiles, mild or hot,Vegetable oil spray (for the skillet),1 cup fresh or frozen corn kernels,1/2 cup sliced cilantro leaves,2 cups grated Monterey jack cheese,2 cups shredded, cooked chicken,1 cup green salsa, , or store-bought (for serving)",6 servings,5,1.0,"Enjoy the flavors of tamales without all of the work. Rather than individual tamales wrapped in corn husks, we made a pie! Use rotisserie chicken and canned green chiles to make the recipe even easier."
24,Sally Vargas,Tex-Mex Shepherd’s Pie,chicken,"['gold', 'potatoes', 'milk', 'cheddar', 'onion', 'beans', 'corn', 'salsa']",25,30,"['family-friendly', 'freezer-friendly', 'make-ahead', 'texmex']","2 1/2 pounds (5 to 6 medium) Yukon Gold potatoes,1 tablespoon salt, divided,4 tablespoons unsalted butter, cut into slices,1/2 cup milk, or more as needed,1 1/2 cups grated sharp cheddar cheese,1/8 teaspoon pepper,2 tablespoons olive oil,1 medium onion, finely chopped,1 large garlic clove, finely chopped,1 teaspoon dried oregano,1/2 teaspoon ground cumin,1 (15-ounce) can black beans, rinsed and drained,1 cup frozen corn,2 cups shredded, cooked chicken,2 cups of your favorite salsa",6 to 8,5,2.0,"Get your forks ready and dig into this Tex Mex take on the comfort food classic Shepherd’s Pie. It’s spicy, cheesy and loaded with chicken, beans, and corn, then topped with creamy mashed potatoes. You’re looking at pure weeknight dinner deliciousness."
25,Irvin Lin,Feta-Brined Roast Chicken,chicken,"['feta', 'chicken', 'mediterranean', 'style', 'lemons', 'baby', 'greens']",15,50,"['feta', 'roast chicken']","2 ounces feta cheese,2 teaspoons kosher salt,4 cups water,3 1/2 to 4 pounds whole chicken,1 tablespoon dried parsley,1 1/2 teaspoons kosher salt,1/2 teaspoon fresh ground black pepper,1 1/2 teaspoon dried oregano, Greek or Mediterranean-style preferred,2 large lemons,2 tablespoon olive oil,4 tablespoons olive oil,2 ounces feta cheese, crumbled,5 ounces mixed baby greens",Serves 4,5,5.0,"If you've never had Feta-Brined Roast Chicken before, you are in for the surprise of your life, because it's THAT GOOD. All other chicken roasting methods should bow before it. "
