,author,dish,type,inglst,time_prep,time_cook,tags,ingredients,servings,rating_star,rating_num,meta_description
164,Sally Vargas,Whole Wheat Pasta with Kale Pesto,vegetarian,"['kale', 'cashews', 'romano', 'pesto', 'wheat', 'linguine', 'spaghetti', 'bucatini', 'lemon', 'juice', 'mozzarella', 'cheese']",15,15,"['kale', 'pasta and noodles', 'pesto']","1 bunch lacinato kale (about 12 ounces), stems removed and leaves torn into large pieces,1/2 cup unsalted cashews,2 cloves garlic, peeled,1/2 cup finely grated Parmesan or Romano,1/3 cup olive oil,1/4 teaspoon salt,1/8 teaspoon ground black pepper,Water, as needed, to thin the pesto,1 pound whole wheat linguine, spaghetti, or bucatini.,2 to 3 tablespoons lemon juice, or to taste,8 ounces fresh mozzarella cheese, cut into 1-inch pieces",4 to 6,,,This Whole Wheat Pasta with Kale Pesto is a quick and easy meatless dinner! Make your pesto with cashews for extra creaminess. Blanching the kale also helps keep the pesto green.
165,Sheryl Julian,Fattoush Bread Salad,vegetarian,"['rounds', 'pepper', 'cucumbers', 'cucumber', 'radishes', 'tomatoes', 'pint', 'cherry', 'tomatoes', 'onion', 'scallions', 'parts', 'juice']",20,10,"['salad', 'budget', 'middle eastern', 'vegetarian']","2 rounds pita bread (8- to 12-inches),Olive oil (for toasting the pita),Salt and pepper, to taste,4 Persian, pickling, or other small cucumbers, thinly sliced (or 1 English cucumber, trimmed, halved vertically, and thinly sliced),4 radishes, trimmed and thinly sliced,2 large tomatoes, cored and cut into 1-inch pieces,1/2 pint cherry tomatoes, halved,1/4 red onion, very thinly sliced,1/4 cup sliced scallions, white and light green parts,Juice of 1 lemon, or more to taste,4 tablespoons olive oil,Large handful fresh mint leaves, coarsely chopped,Large handful fresh parsley leaves, coarsely chopped",4,,,"Easy Middle Eastern fattoush! Crispy pita chips, fresh vegetables, and a tangy dressing. 30 minutes."
166,Jessica Gavin,Cacio e Pepe,vegetarian,"['spaghetti', 'spaghetti', 'pecorino', 'romano', 'cheese', 'reggiano', 'cheese']",10,20,"['cooking for two', 'quick and easy', 'italian', 'pasta and noodles']","1 pound spaghetti, bucatini, or thick spaghetti,1 3/4 teaspoons kosher salt, divided,3 ounces (1 3/4 cup) Pecorino Romano cheese, fresh and finely grated,1 ounce (1/2 cup) Parmigiano Reggiano cheese, fresh and finely grated,2 tablespoons heavy cream,2 teaspoons extra-virgin olive oil,1 teaspoon black pepper, freshly cracked, plus extra for garnish","2 servings as an entree, 4 servings as a side dish",5,2.0,"Cacio e pepe is the most divine pasta dish made with simple, high quality ingredients. Tender noodles tossed in a two-cheese blend and a hint of cream ensure luscious forkfuls. Freshly cracked black pepper adds tiny spicy bursts of flavor with each bite."
167,Emma Christensen,5 Tips for Raising an Adventurous Eater,vegetarian,"['beets', 'flour', 'coarse', 'egg', 'ricotta', 'cheese', 'cheese']",60,10,"['cookbooks', 'kid-friendly', 'vegetarian', 'gnocchi']","2 medium raw beets (about 8 ounces total),1/4 teaspoon sea salt,1 tablespoon olive oil,1 1/2 cups all-purpose flour, plus more for dusting,3/4 cup coarsely grated Parmesan cheese,1 teaspoon coarse salt,1 large egg,1 cup ricotta cheese,Butter or olive oil,1/4 cup finely grated Parmesan cheese for garnish",4 servings,,,"How do you raise an adventurous eater? One who loves veggies and trying new foods? We've got 5 great tips from Vicki and Misha Collins and their new cookbook The Adventurous Eaters Club, plus a VIDEO of making beet gnocchi together!"
168,Nick Evans,Stuffed Shells with Summer Squash and Ricotta,vegetarian,"['onion', 'squash', 'squash', 'ricotta', 'cheese', 'mozzarella', 'cheese', 'egg', 'pasta', 'shells', 'prosciutto', 'breadcrumbs']",30,45,"['eat your food', 'make-ahead', 'vegetarian', 'summer squash']","2 tablespoons olive oil,1/2 sweet onion, diced,2 cups yellow squash, chopped (from about two small squash),8 ounces ricotta cheese,8 ounces grated mozzarella cheese,1 large egg,1/2 teaspoon salt,12 ounces large pasta shells (about 30),2 cups marinara sauce,1 teaspoon fresh thyme,1/2 teaspoon black pepper,3 ounces prosciutto,1/4 cup breadcrumbs,1 tablespoon olive oil",6-8 servings,5,3.0,It's summer squash season! Try these Stuffed Shells with Yellow Squash and Ricotta for an easy and delicious summertime meal. Easy to make ahead and also freezes well!
169,Sally Vargas,Crispy Cheese and Mushroom Quesadillas,vegetarian,"['cremini', 'button', 'wild', 'mushrooms', 'scallions', 'cheddar', 'monterey', 'jack', 'corn', 'tortillas', 'jalapeño', 'peppers']",10,10,"['budget', 'quick and easy', 'mushrooms', 'quesadilla']","2 tablespoons olive oil,1 pound cremini, button, or wild mushrooms, or a combination, thickly sliced,1 clove garlic, finely chopped,1/2 bunch scallions, thinly sliced,1/4 teaspoon salt,1/8 teaspoon ground black pepper,1 1/2 cups (about 6 ounces) grated cheddar or Monterey Jack, or a combination,A small handful of fresh cilantro leaves,10 (6-inch) corn tortillas,Salsa,Jalapeño peppers",5 (6-inch) quesadillas,5,2.0,"Crispy, cheesy quesadillas come together in just minutes! To make these a more complete meal, we add mushrooms to the mix. They make a quick snack, or a full meal with a salad or soup on the side."
170,Carrie Havranek,Sweet Corn and Goat Cheese Quesadillas,vegetarian,"['corn', 'kernels', 'zucchini', 'scallions', 'parts', 'goat', 'cheese', 'tortillas', 'corn', 'tortillas']",10,15,"['quick and easy', 'vegetarian', 'corn', 'quesadilla']","3 cups corn kernels, fresh, frozen, or canned,1 tablespoon butter,1 teaspoon kosher salt, divided,1/2 teaspoon freshly cracked black pepper,2 tablespoons olive oil,2 cups zucchini, diced no more than 1/2-inch thick,3 scallions, chopped, green parts included,4 ounces goat cheese, slightly softened,1/2 cup large basil leaves, packed loosely,4 8-inch flour tortillas (or 6 to 8 6-inch corn tortillas)","4 to 8 quesadillas, depending on size",5,1.0,"Sweet corn! Zucchini! Goat cheese! Basil! Fold these up in a quesadilla, and you've got one quick dinner. If you need a super easy meal to make on a hot summer day, this is definitely it."
171,Nick Evans,Sweet Corn Gnocchi Skillet,vegetarian,"['gnocchi', 'kernels', 'corn', 'corn', 'kernels', 'onion', 'mozzarella', 'balls', 'pearls', 'ciliegine']",15,20,"['eat your food', 'kid-friendly', 'corn', 'gnocchi']","1 pound gnocchi,2 tablespoons olive oil,Kernels from 3 ears sweet corn, or about 3 cups corn kernels,1 small sweet onion, diced,3 cloves garlic, minced,1/2 cup heavy cream (optional),1/2 teaspoon salt,Ground black pepper,8 ounces small mozzarella balls (also called pearls or ciliegine),Fresh basil, minced",4 servings,,,"It's sweet corn season! Make the most of it with this sweet and creamy Sweet Corn Gnocchi Skillet. Fast, filling, and kid-friendly—it's a win for everyone!"
172,Sally Vargas,Spanakopita,vegetarian,"['packages', 'spinach', 'scallions', 'eggs', 'milk', 'ricotta', 'sticks', 'phyllo', 'filo', 'sheets', 'refrigerator']",30,40,"['family-friendly', 'greek', 'vegetarian', 'spinach']","2 (16-ounce) packages frozen chopped spinach, thawed,1 tablespoon olive oil,1 bunch scallions, thinly sliced, including some of the green part,3 large eggs, lightly beaten,8 ounces (about 1 1/2 cups) crumbled feta,8 ounces (1 cup) whole milk ricotta,3 tablespoons chopped fresh dill,1/3 cup chopped fresh parsley,1/2 teaspoon kosher salt,8 ounces (2 sticks) unsalted butter, melted,1 pound phyllo (filo) dough (about 18 sheets), defrosted in the refrigerator",6 servings,,,"Spanakopita! Spinach, feta, ricotta, and fresh herbs are encased in layers of flaky, buttery phyllo to create this easy-to-make vegetarian Greek pie. Spanakopita is often folded into triangles, but we opted to make it into a quick and simple casserole. Serve as a side or a vegetarian main course!"
173,Carrie Havranek,No-Bake Lasagna,vegetarian,"['lasagna', 'noodles', 'milk', 'ricotta', 'lemon', 'pepper', 'shallots', 'chard', 'purpose', 'zucchini', 'summer', 'squash', 'cherry', 'grape', 'tomatoes']",10,20,"['favorite summer', 'vegetarian', 'lasagna', 'tomatoes', 'zucchini']","6 to 8 lasagna noodles,1 (16-ounce) container whole milk ricotta cheese,Zest of one lemon,3/4 teaspoon kosher salt,1/2 teaspoon pepper,2 tablespoons olive oil, divided,1/4 cup minced shallots,1 bunch Swiss chard, stems removed and chopped (save the leaves for another purpose),1 clove garlic, minced,2 1/2 cups zucchini, sliced 1/2-inch thin and quartered,1 1/2 cups summer squash, sliced 1/2-inch thin and quartered,2 1/2 cups mixed cherry or grape tomatoes, halved,1 bunch basil, largest leaves",4 to 6 servings,5,1.0,"Yes, you can have lasagna in the summer without turning on the oven! This one is layered with lemony ricotta, tomatoes, zucchini, and fresh basil. "
174,Sally Vargas,Spinach-Stuffed Portobello Mushrooms,vegetarian,"['cremini', 'button', 'mushrooms', 'shallots', 'portobello', 'mushrooms', 'spinach', 'gouda', 'cheddar', 'cheese']",15,25,"['vegetarian', 'mushrooms']","1/2 pound cremini or button mushrooms, halved,2 large shallots (4 ounces), quartered,4 large portobello mushrooms,4 tablespoons olive oil, divided,1/2 teaspoon salt,1/4 teaspoon freshly ground black pepper,5 ounces (about 4 cups) baby spinach leaves,1 tablespoon water,1 teaspoon dried thyme,3 tablespoons sour cream,1 cup (about 4 ounces) grated Swiss, Gouda, or cheddar cheese,2 tablespoons chopped parsley (for garnish)",4 servings,,,"Spinach-Stuffed Portobello Mushrooms are a vegetarian delight that even a die-hard meat eater will enjoy! They’re also gluten-free and suitable for anyone on a keto plan.

"
175,Sally Vargas,Creamy Basil Artichoke Mac and Cheese,vegetarian,"['pasta', 'pasta', 'cavatappi', 'milk', 'cheese', 'fontina', 'cheddar', 'jar', 'hearts', 'size', 'cayenne', 'breadcrumbs']",15,10,"['vegetarian', 'mac cheese']","Salt for the pasta water,3/4 pound pasta, such as elbows or cavatappi,1/3 cup packed fresh basil leaves,2 cups heavy cream,1/2 cup whole milk,4 ounces cream cheese, softened at room temperature and cut into chunks,1 cup grated Fontina (about 3 ounces),3/4 cup grated sharp cheddar (about 3 ounces),1/2 cup grated Parmesan (about 2 ounces),1 (8-ounce) jar marinated artichoke hearts, drained and cut into bite size pieces,Pinch cayenne pepper,1 cup soft, fresh breadcrumbs,2 to 3 tablespoons olive oil,Pinch of salt",Serves 6,5,1.0,"This mac and cheese with fresh basil and artichokes takes the classic to new heights! The sauce is infused with basil and made with a blend of melted cheeses. No roux! (P.S. Your kids will love this, too!) "
176,Jessica Gavin,Cauliflower Fried “Rice”,vegetarian,"['tofu', 'pepper', 'cauliflower', 'vegetable', 'eggs', 'onion', 'carrots', 'bell', 'dice', 'peas', 'onions']",30,15,"['stir-fry', 'low carb', 'cauliflower', 'fried rice']","8 ounces extra firm tofu, cut into 1/2-inch cubes,1/2 teaspoon sesame oil, divided,1/4 teaspoon white pepper, divided,1/2 teaspoon kosher salt, divided,1 head cauliflower (about 2 1/2 pounds),2 tablespoons vegetable oil, divided,2 large eggs, whisked,1 teaspoon minced garlic,1 teaspoon minced ginger,1/4 cup finely diced red onion,1/2 cup carrots, 1/4-inch dice,1/2 cup red bell pepper, 1/4-inch dice,1/2 cup peas, frozen and defrosted,1 tablespoon soy sauce,2 tablespoons green onions, thinly sliced",4 Servings,,,"Here's a low-carb version of fried rice, loaded with vegetables to satisfy your Chinese takeout cravings. Cauliflower florets are quickly chopped and stir-fried to create a flavorful fried “rice” dish! 

"
177,Sally Vargas,Cheesy Spaghetti Squash Casserole,vegetarian,"['spaghetti', 'onion', 'peppers', 'milk', 'flour', 'baby', 'cheese']",60,45,"['casserole', 'low carb', 'vegetarian', 'spaghetti squash']","1 tablespoon olive oil plus more for the baking dish,1 spaghetti squash, about 3 pounds,2 teaspoons salt,1/2 teaspoon ground black pepper,1 onion, finely chopped,1 clove garlic, minced,1/2 cup jarred roasted red peppers, thinly sliced,2 tablespoons chopped fresh sage leaves,3 eggs,1 cup whole milk,3 tablespoon flour,1 1/2 cups (5 ounces) grated Jarlsberg or baby Swiss cheese,1/2 cup (2 ounces) finely grated Parmesan",6 to 8 servings,5,2.0,"This Cheesy Spaghetti Squash Casserole is loaded with cheese, fresh sage, and roasted red peppers. This vegetarian casserole makes a rich, decadent main dish or the perfect vegetarian holiday side."
178,Jessica Gavin,Cauliflower Gnocchi with Creamy Sun-Dried Tomato Sauce,vegetarian,"['batch', 'regular', 'sun', 'tomatoes', 'romano', 'cheese']",35,25,"['cauliflower', 'gnocchi', 'sun dried tomatoes']","1 batch , (or regular ,), homemade or store-bought,1 tablespoon olive oil,1/4 cup finely chopped shallots,1 tablespoon minced garlic,2/3 cup julienned sun-dried tomatoes, oil drained,1/2 cup unsalted vegetable stock,1 cup half-and-half,1/2 teaspoon sea salt,1 teaspoon chopped fresh oregano, plus more for garnish  (or 1/2 teaspoon dried),1 tablespoon roughly chopped basil, plus more for garnish ( or 1 1/2 teaspoons dried),Black pepper for garnish,1/4 cup shaved Pecorino Romano cheese",2 servings,,,"Kick your cauliflower gnocchi up a notch with this creamy sun-dried tomato sauce with fresh herbs makes for a rustic, delicious dish! Regular gnocchi works great, too."
179,Sally Vargas,Butternut Squash Enchiladas,vegetarian,"['butternut', 'squash', 'onion', 'whole', 'tomatoes', 'juice', 'chili', 'chili', 'brush', 'tortillas', 'beans', 'monterey', 'jack', 'avocado', 'radishes', 'onion', 'milk', 'consistency']",45,25,"['family-friendly', 'favorite fall', 'vegetarian', 'butternut squash']","1 (2-pound) butternut squash, seeds removed and cut into 3/4-inch pieces,1 large onion, cut into 8 wedges,2 cloves garlic,2 tablespoons olive oil,1/2 teaspoon salt,1/8 teaspoon black pepper,1 (28-ounce) can whole tomatoes with juice,1 tablespoon ancho chili powder, or regular chili powder,1/2 teaspoon oregano,1/2 teaspoon cumin,1/2 teaspoon salt,1 tablespoon olive oil,About 1/4 cup olive oil, to brush on the tortillas,1 (15-ounce) can black beans, rinsed and drained,12 (7-inch) ,2 cups grated Monterey Jack cheese,1 handful cilantro leaves,1 avocado, sliced,6 radishes, thinly sliced,1/4 red onion, sliced,1/2 cup sour cream, thinned with milk to the consistency of thick cream",6 servings,5,1.0,"Butternut squash enchiladas are a vegetarian dinner dream. The slightly sweet combination of squash combined with the rich, earthy spices of ancho chili powder, cumin, and oregano create a sure-to-please vegetarian take on a classic. "
180,Carrie Havranek,Easy Avocado and Black Bean Quesadillas,vegetarian,"['avocados', 'juice', 'lime', 'onion', 'moons', 'coriander', 'yellow', 'orange', 'bell', 'pepper', 'juice', 'lime', 'beans', 'flour', 'tortillas', 'fresco', 'cheddar', 'cheese', 'pico', 'salsa']",10,15,"['family-friendly', 'avocado', 'black bean', 'quesadilla']","2 large or 3 small avocados,Juice of 1/2 lime,Pinch of kosher salt,2 tablespoons olive oil, divided,1 cup red onion, sliced into 1/4-inch half moons,1/2 teaspoon kosher salt,1 1/2 teaspoons cumin,1 1/2 teaspoons dried oregano,3/4 teaspoon coriander,1/2 yellow, red, or orange bell pepper, deseeded and chopped into 1/2-inch pieces,Juice of 1/2 lime,1 (15.5-ounce) can black beans, drained and rinsed,4 8-inch flour tortillas,1 cup queso fresco, crumbled or grated,1 cup sharp cheddar cheese, grated,Sour cream,Pico de gallo or salsa",4 servings ,,,"Creamy avocados and savory black beans are a great match. Load them onto a quesadillas, add a mix of cheeses, and dinner is served in minutes! This is such an easy and kid-friendly weeknight dinner."
181,Nick Evans,Vegan Sloppy Joes,vegetarian,"['lentils', 'onion', 'pepper', 'carrots', 'chili', 'tomato', 'apple', 'cider', 'pepper', 'buns', 'onion', 'pickles']",10,30,"['eat your food', 'family-friendly', 'quick and easy', 'lentil']","1 cup green lentils,1/4 teaspoon salt,2 tablespoons olive oil,1 medium yellow onion, diced small,1 green pepper, diced small,2 small carrots, diced small,3 cloves garlic, minced,1 tablespoon mild chili powder,2 teaspoons paprika,1/2 cup ketchup,1 cup tomato sauce,2 tablespoons apple cider vinegar,2 tablespoons brown sugar,1/2 cup water,Salt and pepper, to taste,Buns, for serving,Sliced red onion, for serving,Pickles, for serving",8 sandwiches,5,1.0,"These Vegan Sloppy Joes are made with green lentils and a spice blend so good you’ll be licking the plate. You won't miss the meat! Great make-ahead or freezer meal, too."
182,Sally Vargas,Cauliflower Steak Sandwiches with Red Pepper Aioli,vegetarian,"['juice', 'peppers', 'mayonnaise', 'maras', 'pepper', 'cauliflower', 'bread', 'tomatoes', 'greens', 'choice', 'crisp', 'lettuce']",15,35,"['sandwich', 'vegetarian', 'cauliflower']","1 clove garlic, thinly sliced,2 tablespoons lemon juice,Pinch of salt,3/4 cup roasted red peppers from a jar, drained and diced,1/2 cup mayonnaise (any kind),1/4 teaspoon Maras, Aleppo, or other red pepper flakes,2 medium or 1 very large head of cauliflower,3 to 4 tablespoons olive oil,1/2 teaspoon salt,1/8 teaspoon ground black pepper,1 teaspoon smoked paprika,8 slices sourdough bread,2 large tomatoes, thickly sliced,2 handfuls arugula, or other greens of your choice, such as crisp lettuce",4 sandwiches,,,"Roasted cauliflower “steaks” make a satisfying and filling vegetarian sandwich. This recipe boosts the flavor factor with a quick and easy aioli sauce, sliced tomatoes, and spicy arugula. "
183,Jessica Gavin,Vegetable Pot Pie,vegetarian,"['sheets', 'pastry', 'sheets', 'onions', 'carrots', 'dice', 'mushrooms', 'potatoes', 'milk', 'egg', 'wash', 'peas', 'egg']",30,40,"['family-friendly', 'comfort food', 'pot pie']","1 package (2 sheets, 17.3 ounces) puff pastry sheets, thawed,1/3 cup unsalted butter,1 cup diced red onions, 1/4-inch dice,1 cup diced carrots, 1/4-inch dice,1/2 cup diced celery, 1/4-inch dice,1 tablespoon minced garlic,1/2 teaspoon dried thyme,8 ounces sliced brown mushrooms,1 1/2 pounds russet potatoes, 1/4-inch dice,1 teaspoon kosher salt,1/2 teaspoon black pepper,1/3 cup flour,1 1/2 cups vegetable stock,1 cup whole milk, plus 1 tablespoon for egg wash,1 cup peas,1 tablespoon chopped parsley,1 large egg, whisked",8 vegetable pot pies (8-ounce sized ramekins),5,1.0,"Make a comforting bowl of savory vegetable pot pie, topped with a flaky crust. This version is loaded with tender vegetables and baked with a puff pastry lid for a hearty, individually portioned meal. "
184,Summer Miller,Easy Tomato Soup,vegetarian,"['onion', 'flour', 'tomatoes', 'chicken']",20,20,"['dinner', 'soup', '1-pot']","5 tablespoons butter,1 large onion, yellow or white, diced,4 large cloves garlic, minced,1 1/2 teaspoons kosher salt,1 1/2 teaspoons freshly cracked pepper,3 tablespoons flour,1 (28 oz) can crushed or diced tomatoes,1 (8 oz) can tomato sauce,4 cups (32 oz) low sodium chicken stock,1 tablespoon sugar",8 1-cup servings,5,6.0,"This Classic Tomato Soup is rich with a velvety texture. It’s easy to make with canned tomatoes, and perfectly suited for all of your grilled cheese dipping needs. Better than a can of Campbell's and just about as easy!"
185,Carrie Havranek,Marge Perry and David Bonom’s Easy Skillet Lasagna,vegetarian,"['milk', 'skim', 'ricotta', 'pecorino', 'romano', 'onions', 'spinach', 'tomatoes', 'noodles', 'milk', 'skim', 'mozzarella', 'cheese']",10,45,"['cookbooks', 'family-friendly', '1-pot', 'vegetarian', 'lasagna']","2 cups whole milk or part-skim ricotta,1/3 cup grated pecorino Romano cheese,2 tablespoons olive oil,3 medium onions, chopped (about 3 cups),4 garlic cloves, minced,1 teaspoon dried basil,1 teaspoon dried oregano,1 (10-ounce) package frozen chopped spinach, thawed and squeezed dry,1 (28-ounce) can crushed tomatoes,1/2 teaspoon salt,1/4 teaspoon ground black pepper,8 ounces lasagna noodles, broken in half (across),6 ounces whole milk or part-skim mozzarella cheese, shredded",4 to 6 servings,,,"How about a quicker, easier lasagna? Pull pasta and canned tomatoes out of the pantry, frozen spinach from the freezer, pick up some cheese on the way home, and you’re on your way to lasagna in an hour."
186,Jessica Gavin,Cauliflower Gnocchi (Trader Joe’s Copycat!),vegetarian,"['florets', 'omit', 'version']",30,25,"['how to', 'gluten-free', 'vegan', 'cauliflower', 'gnocchi']","4 cups cauliflower florets (14 ounces),1/2 teaspoon sea salt,3 tablespoons olive oil, divided,1/2 cup , ( 2 3/4 ounce, 78g),1/4 cup , (1 1/4 ounce, 39g),Parmesan cheese (omit for vegan version),Fresh chopped parsley,Fried sage leaves",2 servings,5,7.0,"Trader Joe’s gluten-free cauliflower gnocchi has become a popular frozen food kitchen staple. This copycat version uses five ingredients—so easy! Add it to soup, toss with your favorite sauce, or sauté with a little olive oil for a simple Italian dinner."
187,Garrett McCord,"Grilled Cheese Sandwich with Mozzarella, Red Peppers, and Arugula",vegetarian,"['bread', 'mayonnaise', 'pepper', 'peppers', 'moisture', 'moisture', 'mozzarella', 'roll', 'arugula']",5,15,"['quick and easy', 'vegetarian', 'grilled cheese sandwich', 'mozzarella']","8 slices sourdough bread,Butter, soft and at room temperature,Dijon mustard, to taste,Mayonnaise, to taste,Salt,Pepper,18 ounces jarred roasted peppers (oil- or water-packed), patted dry of excess moisture,12 ounces low-moisture mozzarella, cut into 1/4-inch slices (or shredded, if that’s how you roll),2 cups arugula",4 sandwiches,5,1.0,"Ready to try a new kind of grilled cheese? This Grilled Cheese with Mozzarella, Roasted Red Peppers, and Arugula is sweet, peppery, and too tempting to pass up!"
188,Carrie Havranek,Maria Lichty’s Pesto Havarti Mac and Cheese,vegetarian,"['spinach', 'thinner', 'pesto', 'lemon', 'juice', 'lemon', 'wheat', 'elbow', 'macaroni', 'orecchiette', 'milk', 'mozzarella', 'spinach', 'pesto', 'pesto']",5,15,"['cookbooks', 'budget', 'kid-friendly', 'mac cheese', 'pesto']","4 cups packed spinach leaves,2 cups packed fresh basil leaves,1/2 cup extra-virgin olive oil, or more for a thinner pesto,1/4 cup grated Parmesan cheese,2 tablespoons fresh lemon juice (1 large lemon),2 garlic cloves, peeled,1/2 teaspoon kosher salt, plus more to taste,1/4 teaspoon freshly ground black pepper, plus more to taste,Kosher salt,Freshly ground black pepper,3 cups (12 ounces) whole-wheat elbow macaroni (orecchiette also works well),4 tablespoons unsalted butter,1/4 cup all-purpose flour,2 cups whole milk, at room temperature,2 cups shredded Havarti or mozzarella cheese,3 tablespoons spinach-basil pesto (or store-bought pesto)",6 servings ,5,1.0,"Mac and cheese goes green with this spinach and basil pesto from cookbook author Maria Lichty of Two Peas and Their Pod. Havarti adds a silky, creamy touch to this comfort food classic."
189,Sally Vargas,Butternut Squash and Black Bean Skillet Dinner,vegetarian,"['butternut', 'squash', 'onion', 'chili', 'chili', 'choice', 'fire', 'tomatoes', 'beans', 'baby', 'spinach', 'pepitas', 'pumpkin']",15,25,"['family-friendly', 'vegetarian', 'butternut squash', 'quinoa']","1 pound peeled and seeded butternut squash, cut into 1/2-inch cubes,3 tablespoons olive oil,3/4 teaspoon salt,1/8 teaspoon ground black pepper,1 cup red quinoa,1 medium onion, finely chopped,2 cloves garlic, finely chopped,1 teaspoon ancho chili powder, or chili powder of your choice,1/2 teaspoon ground cumin,1 teaspoon dried oregano,1 1/4 cups water or low-salt vegetable stock,1 (15-ounce) can fire-roasted diced tomatoes,1 (15-ounce) can black beans, rinsed and drained,2 large handfuls baby spinach leaves,1/3 cup pepitas (green pumpkin seeds),3 ounces (1/2 cup) crumbled cotija cheese (optional),1/2 cup cilantro leaves",4-6 servings,5,1.0,"Looking for dinner that’s healthy in a hurry? The whole family will love this vegetarian skillet dinner! It’s loaded with the sweet and earthy flavors of roasted butternut squash, black beans, and quinoa, seasoned with cumin and chili powder. The best part? It’s ready, start to finish, in about 45 minutes."
190,Prerna Singh,Chana Masala,vegetarian,"['chickpeas', 'chickpeas', 'cinnamon', 'cardamom', 'pods', 'onion', 'coriander', 'turmeric', 'tomatoes', 'masala']",15,30,"['dinner', 'indian', 'vegan', 'vegetarian']","1 1/2 cups dry chickpeas (soaked overnight), or a 28-oz can low sodium chickpeas,2 tablespoons vegetable oil,4 whole cloves,1/2 teaspoon cumin seeds,1-inch piece cinnamon,4 green cardamom pods,1/2 cup minced red onion,1 1/2 tablespoons ground coriander,1 tablespoon ,1/2 teaspoon salt,1/2 teaspoon ground turmeric,3/4 cup chopped tomatoes,1 1/2 teaspoons garam masala,1/4 cup chopped fresh cilantro (garnish)",Serves 6,5,1.0,"Chana masala, also called chole masala, is a vegetarian and vegan Indian comfort food packed with flavor and perfect for dinner (or lunch) any day of the week! It also freezes beautifully, so it works well as a make-ahead freezer meal."
