,author,dish,type,inglst,time_prep,time_cook,tags,ingredients,servings,rating_star,rating_num,meta_description
581,Sally Vargas,"Foil Packs with Sausage, Corn, Zucchini and Potatoes",,"['sausages', 'potatoes', 'onion', 'root', 'bell', 'peppers', 'zucchini', 'squash', 'rounds', 'corn', 'cob']",15,20,"['grill', 'corn', 'sausage', 'zucchini']","4 fully cooked sausages (12 ounces), any kind, cut into 1-inch thick slices,12 small potatoes (12 ounces), halved or quartered if large,1 large red onion, cut into wedges through the root,2 yellow or red bell peppers, seeded and cut into 1-inch wide strips,1 zucchini, cut into 1/2-inch thick rounds,1 yellow squash, cut into 1/2-inch thick rounds,2 ears corn on the cob, husked and cut in half,3 tablespoons olive oil,1 teaspoon salt,1/4 teaspoon black pepper,1 teaspoon dried oregano,4 thyme sprigs,4 rosemary sprigs",4 servings,,,"Foil packs on the grill are so easy! Just toss together veggies and some sausage, and close them up in foil before tossing on the grill. It's a mostly hands-off process that brings together the best flavors of summer. "
582,Sabrina Modelle,Grilled Salmon with Peach Salsa,,"['onion', 'skin', 'salmon', 'grapeseed', 'avocado', 'peaches', 'peaches', 'onion', 'lemon', 'juice', 'jalapeño']",20,10,"['grill', 'salmon', 'salsa']","1 1/2 teaspoons smoked paprika,1 1/2 teaspoons granulated garlic,1 1/2 teaspoons granulated onion,1 teaspoon light brown sugar,1/2 teaspoon salt,1/2 teaspoon black pepper,1 pinch of cayenne (optional),1 pound skin-on salmon filets (about 4 pieces),2 to 3 tablespoons neutral cooking oil, such as grapeseed, avocado, or canola oil,2 heaping cups diced peaches, unpeeled (about 3 medium peaches),1 medium ripe avocado, diced,1/4 cup finely diced red onion,1/4 cup chopped cilantro,2 tablespoons finely minced jalapeño (optional),1 tablespoon fresh lemon juice,1/4 teaspoon salt,A few slices of jalapeño,A few sprigs of cilantro",4 servings ,5,2.0,A peach-avocado salsa is a delicious complement to this grilled salmon. A grill pan ensures the salmon stays crispy throughout the cooking process without sticking to the grill. Winner! 
583,Elise Bauer,Braised Turkey Legs,,"['turkey', 'legs', 'onion', 'pepper', 'cayenne', 'wine', 'cornstarch', 'potatoes', 'carrots', 'turnips', 'parsnips']",10,120,"['stew', 'favorite winter', 'budget', 'turkey stew']","2 turkey legs and 2 thighs, about 4 lbs,1 tablespoon extra virgin olive oil,1 cup finely chopped yellow onion,1 cup of finely chopped celery,Salt, pepper, and cayenne,2 cups water or other braising liquid (dry white wine or stock),Cornstarch,Parsley, chopped, about 1/4 cup, 3 cups chopped or quartered potatoes, carrots, turnips, rutabagas, and/or parsnips",Serves 6-8,5,8.0,"Delicious Turkey Stew! Made with flavorful turkey legs, browned and braised, served with root vegetables."
584,Sally Vargas,Savory Dutch Baby Pancake with Salmon and Fried Egg,,"['eggs', 'milk', 'buckwheat', 'wheat', 'fine', 'eggs', 'salmon', 'ripe', 'tomatoes', 'scallions']",10,20,"['breakfast and brunch', 'quick and easy', 'smoked salmon']","3 large eggs,3/4 cup whole milk,4 tablespoons unsalted butter, melted and divided,1/2 cup all-purpose flour,3 tablespoons buckwheat flour (or whole wheat flour),1/4 teaspoon fine salt (1/2 teaspoon if using Kosher salt),1 tablespoon unsalted butter,4 large eggs,4 ounces thinly sliced smoked salmon,4 small ripe tomatoes, sliced,4 tablespoons sour cream,2 tablespoons chopped fresh parsley,4 tablespoons chopped scallions, thinly sliced including some of the green part,Black pepper, to taste",4 servings,5,1.0,"From its dramatic puffy rise to its whole grain flavor, this Dutch baby pancake is a winner. Top it with smoked salmon and fried eggs and serve it for brunch — or for dinner!"
585,Elise Bauer,Lamb Curry,,"['boneless', 'bone', 'lamb', 'stew', 'meat', 'shanks', 'shoulder', 'steaks', 'onions', 'curry', 'coriander', 'rind', 'lemons', 'apples', 'granny', 'smith', 'apples', 'raisins', 'potatoes', 'rice']",60,120,"['1-pot', 'indian', 'curry', 'lamb']","2 pounds boneless (or 3 pounds bone-in), lamb stew meat, lamb shanks, and/or lamb shoulder steaks,2 onions, chopped (about 3 - 4 cups),3-5 cloves of garlic, crushed,2-3 tablespoons ghee (clarified butter), or 1 tablespoon extra virgin olive oil with 1 tablespoon butter,2-3 tablespoons curry powder (to taste),2 teaspoons salt,1 tablespoon black pepper,1 tablespoon ground coriander,1 tablespoon cumin,1 teaspoon fresh rosemary, chopped,1 teaspoon thyme, dried,2 slices of lemon, with rind (use 3 slices if using Meyer lemons),2 peeled and chopped apples, preferably tart green Granny Smith apples (about 2 cups),1/4 cup (40 g) of golden raisins,1 1/2 cups (350 ml) ,1 1/2 pounds (680 g) small potatoes, quartered,2 cups basmati rice, and/or , to serve",Serves 6,5,7.0,"Craving lamb curry? Make this recipe on the stovetop or in the pressure cooker. Whatever you choose, slowly cooking the lamb is the key to tender lamb in this dish. Make a pot of rice and dinner is served."
586,Jaden Hair,Happy Shrimp Stir Fry,,"['chicken', 'shrimp', 'cornstarch', 'peanut', 'cooking', 'onion', 'iceberg', 'lettuce']",10,15,"['stir-fry', 'chinese', 'gluten-free', 'shrimp']","2 teaspoons sugar,1/2 cup chicken or vegetable broth,3 tablespoons ketchup,1 teaspoon rice vinegar (or white vinegar),1/2 teaspoon sesame oil,1 pound raw shrimp, deveined,2 teaspoons cornstarch,2 tablespoons canola, vegetable or peanut cooking oil,1 teaspoon grated fresh ginger,1-2 garlic cloves, finely minced,1 tablespoon finely sliced green onion,Handful of shredded iceberg lettuce",Serves 4,5,15.0,"A favorite dish for Chinese New Year, shrimp stir-fried in a sauce of ketchup, rice vinegar, sesame oil, sugar, and broth, and served on a bed of lettuce."
587,Elise Bauer,Polenta Sausage Mozzarella Casserole,,"['tomatoes', 'onion', 'fennel', 'sweet', 'sausage', 'casings', 'polenta', 'polenta', 'recipe', 'mozzarella']",10,35,"['dinner', 'comfort food', 'gluten-free', 'polenta']","4 tablespoons extra virgin olive oil,1 28-ounce can crushed tomatoes,1 tablespoon chopped fresh oregano,1 yellow onion, chopped,4 cloves garlic, minced,1/2 teaspoon salt,1/2 teaspoon freshly ground black pepper,1 teaspoon fennel seeds,1 pound sweet Italian sausage (removed from casings),2 pounds of prepared polenta, 1/2-inch slices if using prepared polenta in a tube (can use one recipe of ,, leave out the cream cheese),1/2 pound (8 ounces) fresh mozzarella, sliced into 1/4-inch slices",Makes 6 servings.,5,6.0,"Italian sausage casserole with polenta, Italian sausage, tomato sauce, and Mozzarella cheese."
588,Elise Bauer,Cheese Tacos,,"['corn', 'tortillas', 'cheddar', 'jack', 'salsa', 'apple', 'lettuce', 'beef', 'pork', 'leftovers']",5,5,"['kid-friendly', 'mexican and tex mex', 'gluten-free', 'taco']","Corn tortillas (as many as tacos you want to make, packaged or ,),Butter,Cheddar or jack cheese,Salsa (, or prepared),Avocado,Apple,Lettuce,Strips of cooked chicken, beef, or pork (a great use of leftovers)",,5,8.0,"Simple and easy cheese tacos recipe, made with corn tortillas, fried in a little butter, folded over grated cheddar or Monterey Jack cheese.  Also known as quesadillas."
589,Elise Bauer,Grilled Tuna Kebabs,,"['tuna', 'sturgeon', 'steaks', 'bell', 'onion', 'sweet', 'button', 'mushrooms', 'lemons', 'onion']",20,15,"['grill', 'gluten-free', 'low carb', 'paleo']","1 1/2 pounds tuna, swordfish or sturgeon steaks,1 red bell pepper,1 green bell pepper,1 small onion (sweet if available),6-10 large button mushrooms,2 lemons, cut into wedges,1/2 cup extra virgin olive oil,2 tablespoon chopped onion,1 tablespoon chopped fresh rosemary,1 teaspoon salt,1/2 teaspoon black pepper,2 garlic cloves",Serves 4,5,3.0,"Get your grill on with tuna kabobs! skewers of marinated fresh tuna, onions, bell peppers, and mushrooms."
590,Sally Vargas,How to Do a New England Clambake at Home,,"['steamer', 'clams', 'mussels', 'chorizo', 'sausages', 'choice', 'dogs', 'wine', 'potatoes', 'shallots', 'ears', 'corn', 'cob']",10,20,"['video', 'quick and easy', 'new england', 'clam']","4 pounds total steamer clams and mussels (you can use all clams if you prefer),2 tablespoons olive oil,4 linguica, chorizo, or other fresh sausages of your choice,4 hot dogs (optional, but so good),1 cup white wine,2 cups water,1 teaspoon salt,2 pounds small red potatoes,6 shallots, peeled,Small handful of fresh thyme sprigs,2 bay leaves,4 ears corn on the cob, husked,4 ounces (1 stick) butter, melted, for dipping",4 servings,,,"You don't need to be in Cape Cod in order to make this clambake. Just follow these instructions for a one-pot clambake, New England style, in the comfort of your own home."
591,Elise Bauer,Baked Tilapia with Sun-dried Tomato Parmesan Crust,,"['breadcrumbs', 'italian', 'breadcrumbs', 'onion', 'sun', 'tomatoes', 'fillets', 'beaten', 'egg']",15,15,"['dinner', 'lenten', 'quick and easy', 'fish']","1 cup fine breadcrumbs, seasoned or unseasoned, or 2 cups panko,An additional 2 teaspoons Italian seasoning if you are using unseasoned breadcrumbs or panko,2 teaspoons onion powder,1 teaspoon garlic powder,2 teaspoons paprika,1 teaspoon salt,2 Tbsp grated parmesan cheese,8 sun-dried tomatoes, packed in oil,2 tablespoons extra virgin olive oil,4 tilapia fillets, about 1 1/3 pounds,Flour for dusting, about 1/3 cup,1 beaten egg,2 teaspoons sugar,1/4 cup water",Serves 4,5,3.0,"Easy baked tilapia fillets with sun-dried tomato, Parmesan, breadcrumb crust, and optional berry sauce."
592,Garrett McCord,Chinese Hot and Sour Soup,,"['cloud', 'shiitake', 'mushrooms', 'enoki', 'mushrooms', 'shoots', 'rice', 'cornstarch', 'chicken', 'broth', 'block', 'tofu', 'egg', 'scallions', 'pepper', 'chili', 'optional']",25,15,"['soup and stew', 'chinese']","6 dried ,6 dried ,, black, cloud, straw, or shiitake mushrooms, or one bunch of fresh enoki mushrooms,5 dried ,1 (8-ounce) can bamboo shoots,2 tablespoons red wine vinegar,1 tablespoon white vinegar or rice vinegar,1 1/2 tablespoons of soy sauce,1 tablespoon cornstarch,4 cups chicken broth,1/2 block firm tofu, diced into small cubes,1 large egg, beaten,1 teaspoon of sesame oil,3 scallions, diced,1/4 teaspoon salt,1 1/2 teaspoons finely ground white pepper,1/4 teaspoon chili oil (optional),Cilantro (optional)",Serves 4,5,2.0,"Craving Hot and Sour Soup just like your favorite Chinese restaurant? This recipe will hit the spot! It's made with Chinese mushrooms, bamboo shoots, tofu, and a beaten egg. "
593,Elise Bauer,Lamb Shanks with Butternut Squash,,"['shanks', 'celery', 'ribs', 'onion', 'wine', 'chicken', 'gluten', 'version', 'orange', 'butternut', 'squash', 'cannellini', 'beans', 'lemon', 'zest']",15,240,"['dinner', 'favorite winter', 'gluten-free', 'lamb shank']","4 tablespoons extra virgin olive oil,4 Lamb shanks (1 pound each),Salt and freshly ground pepper,Cloves separated from an entire head of garlic, unpeeled,6 celery ribs, coarsely chopped,4 carrots, coarsely chopped,1 large onion, coarsely chopped,1/2 cup tomato paste,3 cups dry red wine,6 cups chicken stock (use gluten-free stock for gluten-free version),Two 1x3-inch strips of orange zest,3 pounds butternut squash, peeled and cut into 1 inch cubes,1 1/3 cup cooked cannellini beans (about 1 15 ounce can, drained),4 tablespoons chopped parsley,4 cloves of garlic, peeled and minced,4 teaspoons finely grated lemon zest",Serves 4 to 6,5,4.0,"Rich and hearty lamb shank and butternut squash stew, served with parsley, garlic, and lemon gremolata."
594,Elise Bauer,Turkey Zucchini Burger with Garlic Mayo,,"['meat', 'onions', 'parts', 'zucchini', 'mayonnaise', 'lettuce', 'onion', 'burger', 'buns']",15,30,"['favorite summer', 'burger', 'ground turkey']","1 pound ground turkey (thigh meat preferred),2 green onions, white and green parts, minced,2 tablespoons chopped fresh basil,1 tablespoon chopped fresh oregano,1 clove garlic, minced,3/4 teaspoon ground black pepper,1/2 teaspoon salt,3/4 pound of zucchini, grated (about 2 cups),2 tablespoons extra virgin olive oil,1/2 cup mayonnaise,1 clove garlic, finely minced,Several leaves of lettuce,Thinly sliced red onion,Thinly sliced tomato,Burger buns,Butter",Makes 6 turkey burgers,5,2.0,"How to make a turkey burger juicy? With grated zucchini! This turkey zucchini burger has basil, onions, and garlic, served with garlic mayo"
595,Elise Bauer,Stuffed Zucchini with Turkey Sausage,,"['zucchini', 'onion', 'mushrooms', 'wine', 'turkey', 'tomatoes', 'egg', 'pepper']",10,55,"['low carb', 'ground turkey', 'stuffed zucchini', 'zucchini']","1 zucchini about 12 inches long, or 3-4 medium zucchini,3 tablespoons extra virgin olive oil,1/2 cup chopped onion,3 cloves garlic, minced,1/2 cup chopped mushrooms,2 tablespoons dry white wine,1 pound ground turkey,2 diced tomatoes,3 tablespoons chopped fresh basil,1 teaspoon chopped fresh rosemary,3/4 cup grated Parmesan cheese,1 egg, lightly beaten,2 teaspoons salt,2 teaspoons pepper",Serves 4,5,7.0,"Large zucchini stuffed with ground turkey, mushrooms, tomatoes, basil, rosemary, and Parmesan cheese."
596,Sabrina Modelle,Grilled Fish Tacos with Strawberry Pineapple Salsa,,"['strawberries', 'onion', 'chili', 'lime', 'tart', 'sea', 'bass', 'halibut', 'mahi', 'mahi', 'paprika', 'cayenne', 'pepper', 'grapeseed', 'heat', 'grill', 'corn', 'tortillas', 'cabbage', 'radishes', 'lime']",30,10,"['grill', 'quick and easy', 'gluten-free', 'paleo']","1 cup finely diced strawberries,1 cup finely diced pineapple,1/2 cup finely diced red onion,1 clove minced garlic,1 cup roughly chopped cilantro, loosely packed,1 small red chili, diced (optional),1 lime, juiced (about 1 1/2 tablespoons juice),1/4 teaspoon salt,1/4 teaspoon pepper,1/2 teaspoon sugar (optional if the salsa is tart),1 pound firm-fleshed fish (like sea bass, swordfish, halibut, mahi mahi or salmon),1 teaspoon ground cumin,1 teaspoon sweet paprika,1 teaspoon smoked paprika,Heavy pinch of cayenne (optional),1/4 teaspoon salt,1/4 teaspoon pepper,1 tablespoon olive oil,Grapeseed or other high heat oil for grill,12 small (4- to 6-inch) corn tortillas,Shredded red cabbage,Sliced radishes,Avocado,Sour Cream,Lime wedges,Cilantro",Serves 4 to 6,5,2.0,"Grilled Fish Tacos topped with a sweet and tangy Strawberry Pineapple Salsa! This is the perfect summer meal: light, fresh, and fast. Great for a party."
597,Carrie Havranek,Slow Cooker Poached Salmon,,"['wine', 'celery', 'rib', 'peppercorns', 'juice', 'lemons', 'fillets']",5,70,"['dinner', 'slow cooker', 'fish', 'salmon']","3 cups water,1 cup white wine,1/2 cup celery (1 rib),1 cup sliced leeks (1 small),2 teaspoons peppercorns,2 cloves garlic, minced,2 large sprigs fresh dill, plus 2 tablespoons chopped (for garnish),1/4 cup lemon juice (from 2 lemons),1 teaspoon kosher salt,2 to 2 1/2 pounds skin-on fresh salmon, cut into fillets or left whole",6 to 8 servings,5,1.0,"Foolproof salmon in the slow cooker? Yes, please! This method of poaching the salmon in a flavorful broth using the slow cooker guarantees success. "
598,Sally Vargas,"Halibut with Fennel, Peppers, and Tomatoes",,"['halibut', 'fillets', 'juice', 'breadcrumbs', 'onion', 'fennel', 'bell', 'pepper', 'orange', 'bell', 'pepper', 'roma', 'plum', 'tomatoes', 'kalamata', 'olives']",15,30,"['dinner', 'lenten', '1-pot', 'fish and seafood']","4 halibut fillets (6 ounces each),4 teaspoons lemon juice,Leaves from 1 sprig rosemary,Leaves from 2 stems thyme,Leaves from 2 stems basil,Leaves from 2 stems oregano,1/2 cup Panko breadcrumbs,2 teaspoons plus 2 tablespoons plus olive oil,1/2 medium red onion, sliced,1 bulb fennel, cored and sliced,1 yellow bell pepper, seeded and sliced into strips,1 orange bell pepper, seeded and sliced into strips,4 Roma (plum) tomatoes, halved lengthwise and cut into strips,1/2 cup pitted Kalamata olives,3 tablespoons chopped parsley (to garnish),1 lemon, quartered (to garnish)",4 servings,5,1.0,"This halibut is baked nestled in a bed of fennel, peppers, tomatoes, olives and fresh herbs. It's a one skillet supper that's ready in a flash!"
599,Sally Vargas,"Sweet Potato Waffles with Fried Egg, Bacon, and Scallions",,"['cornmeal', 'eggs', 'mash', 'buttermilk', 'scallions', 'spray', 'waffle', 'iron', 'eggs', 'person', 'honey']",20,20,"['breakfast and brunch', 'comfort food', 'sweet potatoes', 'waffle']","12 ounces bacon,1 cup (140g) flour,6 tablespoons (103g) cornmeal,2 teaspoons baking powder,1/2 teaspoon baking soda,1/2 teaspoon salt,3 large eggs,3/4 cup sweet potato mash (See Recipe Note),1 1/2 cups buttermilk,2 tablespoons melted butter,3 scallions, thinly sliced,Cooking spray or vegetable oil (for the waffle iron),1 tablespoon unsalted butter,4 or more large eggs (at least one per person),Honey, for drizzling","6 to 7 waffles, depending on the size of your waffle iron",,,"Make these sweet potato waffles with fried egg, bacon, and scallions for breakfast, lunch, or dinner! Great way to use up leftover sweet potatoes."
600,Sabrina Modelle,One-Pan Roasted Harissa Salmon with Vegetables,,"['salmon', 'fillet', 'beans', 'bell', 'peppers', 'harissa', 'spice', 'blend', 'wine', 'pistachios', 'pint', 'cherry', 'tomatoes', 'pistachios']",10,20,"['dinner', 'sheet pan dinner', 'low carb', 'salmon']","1 1/2 pounds whole salmon fillet,1 1/4 pounds green beans, trimmed,2 medium red bell peppers, sliced,1/4 cup olive oil, divided,2 tablespoons dry harissa spice blend (divided),1/2 teaspoon salt (divided),1 bunch parsley, roughly chopped,2 teaspoons red wine vinegar,2 tablespoons olive oil,1 clove garlic,1/3 cup roasted salted pistachios (optional),1 pint cherry tomatoes, halved,Pinch of salt (or more if not using the pistachios)",4 to 6 servings,,,"One-pan roasted salmon, rubbed with Moroccan harissa spice, roasted with green beans, bell peppers, and cherry tomatoes. Easy and elegant!"
601,Elise Bauer,Grilled Trout with Dill and Lemon,,"['trout', 'tail', 'paper', 'lemon', 'tarragon', 'herb']",10,8,"['grill', 'low carb', 'fish']","Extra virgin olive oil,2 trout, boned (also called ""butterflied"") and cleaned, head and tail still on (or headless if you want),Salt,Pepper,6 paper thin slices of fresh lemon, seeded,Several sprigs of dill (or basil, tarragon, parsley, any tender fresh herb),1 teaspoon butter, cut into small cubes",Serves 2,,,"How to grill whole trout, stuffed with lemon, dill, and dotted with butter. Easy!"
602,Elise Bauer,Grilled Shrimp with Tomato Olive Salsa,,"['shallot', 'wine', 'capers', 'olives', 'tomatoes', 'shrimp']",30,10,"['dinner', 'grill', 'paleo', 'shrimp']","1 large shallot, minced,2 tablespoons red wine vinegar,1 large garlic clove, minced,Salt and black pepper,1 tablespoon small capers,1/2 cup (heaping) chopped black olives,2 pounds plum tomatoes,3 tablespoons extra virgin olive oil,1/4 cup chopped parsley,2 pounds large shrimp, ,3 tablespoons extra virgin olive oil,Salt",Serves 4,,,"Grilled shrimp with an Italian tomato salsa of fresh, uncooked tomatoes, black olives, garlic and parsley."
603,Elise Bauer,Kohlrabi Ham Bake,,"['kohlrabi', 'ham', 'egg', 'yolks', 'mace', 'substitute']",15,45,"['dinner', 'casserole', 'ham', 'kohlrabi']","3 tablespoons butter,4 kohlrabi, peeled and diced,8 ounces thick ham, diced,2 tablespoons fresh chopped parsley,3 egg yolks,1 cup heavy cream,2 tablespoons all-purpose flour,Pinch of mace (can substitute ground nutmeg),Salt and freshly ground black pepper",Serves 4,5,4.0,"Easy and delicious casserole with baked kohlrabi, ham, eggs, and cream."
604,Jaden Hair,Sautéed Shrimp with Tropical Fruit Salsa,,"['coconut', 'shrimp', 'mango', 'pineapple', 'kiwi', 'fruit', 'onion', 'lime', 'chili']",10,15,"['lenten', '1-pot', 'gluten-free', 'shrimp']","1/2 cup sweetened coconut flakes,1 Tbsp cooking oil (coconut oil or canola oil),1 pound raw shrimp, peeled and deveined,1 mango, peeled and diced,1 cup diced pineapple,2 kiwi-fruit, peeled and diced,1/4 cup finely diced red or sweet onion,1 teaspoon sugar, or to taste,1/4 lime,1/8 – 1/4 teaspoon chili powder,Salt and pepper,3 fresh mint leaves, thinly sliced",Serves 4,5,8.0,Sautéed shrimp topped with a mango pineapple kiwi salsa and toasted coconut flakes. 1 pot and takes only 25 minutes to make!
605,Sally Vargas,Turkey Taco Salad,,"['onion', 'chili', 'chili', 'turkey', 'fire', 'tomatoes', 'beans', 'corn', 'kernels', 'hearts', 'pint', 'cherry', 'tomatoes', 'onion', 'radishes', 'monterey', 'jack', 'lime']",15,20,"['salad', 'quick and easy', 'gluten-free', 'ground turkey']","2 tablespoons olive oil,1 medium onion, finely chopped,1 clove garlic, finely chopped,2 1/2 teaspoons ancho chili powder (or substitute regular chili powder),2 teaspoons ground cumin,1 teaspoon oregano,1/4 teaspoon salt,Fresh ground black pepper,1/2 pound ground turkey,1 can (15 ounces) diced fire-roasted tomatoes,1 can (15 ounces) black beans, rinsed and drained,1 cup fresh or frozen corn kernels,2 tablespoons sherry vinegar,1/4 teaspoon salt,Fresh ground black pepper,5 tablespoons olive oil,2 hearts of romaine, chopped or sliced,1/2 pint cherry tomatoes, halved,1/2 red onion, sliced,6 radishes, thinly sliced,2 ripe avocados, sliced,1 cup (4 ounces) shredded Monterey jack cheese, or more, to taste,Handful of cilantro leaves, stems removed,1/2 cup sour cream,1 lime, cut into wedges",4 to 6 servings,,,"Taco Salad made with healthy ground turkey, black beans, and corn. Serve warm or cold over romaine lettuce with fresh tomatoes, avocados, and shredded cheese. Perfect for a mid-week meal or make-ahead lunch."
606,Elise Bauer,Cheesy Apple and Sausage Pie,,"['lining', 'pie', 'x', 'pie', 'crust', 'tart', 'apples', 'onion', 'sweet', 'sausage', 'bulk', 'casings', 'fontina', 'provolone', 'ricotta', 'feta', 'cheese', 'eggs']",15,60,"['dinner', 'casserole', 'apple', 'pie']","1 ,, rolled out and lining a 9 or 10-inch pie dish, or 8x8 baking dish, chilled (or one frozen pie crust),2 large tart green apples, peeled and sliced 1/4-inch thick,1/2 medium onion, chopped (about half a cup),1 teaspoon sugar,3 Tbsp butter,3/4 lb sweet Italian sausage (bulk, or removed from casings),1 clove garlic, minced,2 cups (8 ounces) shredded fontina, provolone, and or asiago cheese,1 cup ricotta cheese,1/4 cup feta cheese,2 eggs, slightly beaten",Serves 8,5,12.0,"A perfect casserole for apple season! Tart green apples baked with sweet Italian sausage in a pie crust, topped with Italian cheeses."
607,Sally Vargas,Stuffed Squash with Turkey and Apples,,"['squash', 'lengthwise', 'rice', 'turkey', 'breakfast', 'sausage', 'shallot', 'celery', 'apple', 'honeycrisp', 'jonagold', 'braeburn', 'dice', 'cranberries']",10,45,"['cooking for two', 'acorn squash', 'ground turkey']","1 medium (about 1 1/4 to 1 1/2 pound) acorn squash, halved lengthwise and seeded,2 tablespoons plus 1 teaspoon olive oil,1 teaspoon salt, divided,1/8 teaspoon ground black pepper,1/2 cup uncooked wild rice,6 ounces ground turkey or ground breakfast sausage,1 small shallot, finely chopped,1 stalk celery, finely chopped,1/2 large apple (Honeycrisp, Jonagold, or Braeburn), unpeeled, cored, and cut into small dice,1 tablespoon chopped fresh sage leaves,1 tablespoon chopped fresh rosemary,2 tablespoons dried cranberries,1 tablespoon fine, dry ",2 servings,5,3.0,"Looking for a delicious and filling dinner for two? Then try this stuffed squash recipe loaded with ground turkey, wild rice, apples, and herbs."
608,Sally Vargas,Sheet Pan Salmon and Broccoli with Miso Butter,,"['stick', 'miso', 'broccoli', 'heads', 'fillets', 'scallions']",10,25,"['sheet pan dinner', 'broccoli', 'salmon']","4 tablespoons (1/2 stick) unsalted butter, at room temperature,2 tablespoons red, white or yellow miso,1 1/2 pounds whole broccoli heads or crowns, with stems,2 tablespoons olive oil,1/2 teaspoon salt,1/4 teaspoon black pepper,4 (6-ounce) center-cut salmon fillets, 1 to 1 1/2 inches thick,2 tablespoons chopped parsley, to garnish,2 scallions, thinly sliced, to garnish,Baked or ,, to serve (optional)",4 servings ,5,2.0,"This one-pan dinner is ready in a flash! Broccoli takes on a sweetness in the oven, and the salmon, topped with miso butter, becomes flavorful and moist. This one is sure to become a favorite!"
609,Hank Shaw,Venison Sauerbraten,,"['roast', 'venison', 'beef', 'chuck', 'cookies', 'wine', 'wine', 'corns', 'berries', 'stalks', 'carrots', 'onion']",0,300,"['dinner', 'german']","3-4 pound roast of venison (or beef chuck),1/4 cup melted butter or extra virgin olive oil,8 gingersnap cookies,3 Tbsp butter,2 Tbsp flour,Salt,1 bottle of red wine,1/2 cup red wine vinegar,2 cups water,1 Tbsp black peppercorns,1 Tbsp juniper berries,1 Tbsp mustard seed,6-8 cloves,3-5 bay leaves,1 Tbsp dried thyme,2 celery stalks, chopped,2 carrots, peeled and chopped,1 medium onion, chopped",Serves 6-8,5,2.0,A classic German pot roast: Venison or beef marinated and then braised in a rich sauce that's finished with crushed ginger snaps.
