,author,dish,type,inglst,time_prep,time_cook,tags,ingredients,servings,rating_star,rating_num,meta_description
367,Sally Vargas,Chicken Stew with Tomatillo Sauce,chicken,"['poblano', 'chiles', 'onion', 'bone', 'skin', 'chicken', 'creamer', 'potatoes', 'yukon', 'gold', 'potatoes', 'bell', 'pepper', 'corn', 'kernels', 'lime', 'tortillas', 'rice']",15,45,"['soup and stew', 'southwestern', 'gluten-free', 'paleo']","12 tomatillos (about 1 1/2 pounds),1 large or 2 small poblano chiles,2 cloves garlic, peeled,1/4 large white onion, sliced,1 cup loosely packed cilantro leaves,Salt to taste,8 bone-in, skin-on chicken thighs (about 3 pounds),Salt and pepper, to taste,2 tablespoons olive oil,1 pound small creamer potatoes (small Yukon gold or red potatoes), halved,1 red bell pepper, seeded and cut into thin strips,1/4 cup or more water,2 cups corn kernels, fresh or frozen,1/2 cup chicken stock or broth,Cilantro, for garnish,1 lime, quartered, for garnish,Tortillas or rice, for serving",4 to 6 servings,,,"Easy stovetop chicken stew with tomatillo sauce, potatoes, corn, and peppers. Perfect for a late-summer dinner."
368,Elise Bauer,Herb Stuffed Roast Chicken,chicken,"['chicken', 'herbs', 'marjoram']",15,60,"['low carb', 'paleo', 'roast chicken']","One 5 pound chicken,Salt,Freshly ground black pepper,3/4 cup loosely packed fresh herbs (basil, parsley, thyme, marjoram or oregano), finely chopped,2 tablespoon extra virgin olive oil,1 lemon, halved,4 bay leaves,1 sprig of fresh rosemary",Serves 4 to 5,5,4.0,"Whole roasted chicken, infused with fresh herbs - parsley, basil, thyme, oregano."
369,Hank Shaw,Grilled Cornish Game Hens,chicken,['game'],40,25,"['dinner', 'grill', 'paleo', 'cornish game hen']","4 game hens,Olive oil,Salt and black pepper,Lemon wedges (optional)",Serves 4-6,5,2.0,"Cornish game hens are first butterflied (spatchcocked), then grilled flattened, with the weight of a brick. Perfect for entertaining!"
370,Sally Vargas,Soba Noodle Soup with Chicken and Bok Choy,chicken,"['chicken', 'chicken', 'broth', 'boneless', 'skinless', 'breast', 'juice', 'thai', 'thai', 'sweet', 'chili', 'soba', 'buckwheat', 'noodles', 'choy', 'scallions', 'lime', 'pepper']",10,20,"['dinner', 'soup and stew', 'quick and easy']","8 cups chicken stock, or low-sodium chicken broth,1 boneless skinless chicken breast (about 12 ounces),2-inch piece of fresh ginger, finely chopped (about 2 tablespoons),1/4 cup lime juice,2 tablespoons Thai fish sauce,3 tablespoons Thai sweet red chili sauce,1 tablespoon brown sugar,8 ounces soba (buckwheat) noodles,4 baby bok choy, cut into 1-inch slices, or halved lengthwise,6 scallions, thinly sliced,A few sprigs Thai basil, mint or cilantro, for garnish,Lime wedges, to serve,Red pepper flakes, for garnish",4 servings,5,1.0,"This soba noodle soup with chicken and baby bok choy is speedy comfort food! Seasoned with ginger, lime, scallions, and herbs. A true 30-minute meal."
371,Elise Bauer,Roast Chicken with Apricot Glaze,chicken,"['chicken', 'apricot', 'preserves']",10,60,"['dinner', 'gluten-free', 'chicken']","2 teaspoons ground cumin,1/2 teaspoon ground cinnamon,1 1/2 teaspoon kosher salt,1 4-pound (1.8 kg) whole chicken,1 tablespoon extra virgin olive oil,1/3 cup (80 ml) apricot preserves",Serves 4,5,4.0,Easiest way to dress up roast chicken? Glaze with apricot preserves!
372,Nick Evans,Sous Vide Chicken and Broccoli,chicken,"['chicken', 'breasts', 'broccoli', 'florets', 'sea', 'table']",20,120,"['dinner', 'sous vide', 'broccoli', 'chicken']","4 medium chicken breasts (6 to 8 ounces each),1 teaspoon salt,1/4 teaspoon black pepper,1 lemon, sliced thin,1 1/2 pounds broccoli florets,2 teaspoons sesame oil,1/2 teaspoon red pepper flakes,Pinch of Kosher, sea or table salt",4 to 6 servings,,,"Hate dry, overcooked chicken? Sous vide is the way to go! This method makes juicy, tender chicken every time. Pair it with sous vide broccoli for easy make-ahead lunches and dinners!"
373,Elise Bauer,Chicken with Mango Chutney Sauce,chicken,"['chicken', 'bone', 'skin', 'ripe', 'onion', 'raisins', 'pepper']",10,40,"['dinner', 'gluten-free', 'chicken', 'mango']","2 pounds chicken thighs, bone in, skin on, trimmed of excess fat,Extra virgin olive oil,Salt and Pepper,2 ripe but firm ,, cubed into 1/2-inch cubes,1 tablespoon extra virgin olive oil,1 medium onion, chopped (about 3/4 cup chopped onion),1 garlic clove, minced,1 tablespoon chopped candied ginger (or fresh ginger),2 tablespoons chopped raisins,1/2 teaspoon mustard seeds,Scant pinch of red pepper flakes,4 tablespoons sugar,3 tablespoons white vinegar,1/2 cup water,Salt to taste",Serves 4,5,3.0,"Roasted chicken thighs served with a sweet sour mango chutney sauce with fresh mangos, onion, garlic, vinegar, sugar, ginger, mustard seeds, and red pepper flakes."
374,Sabrina Modelle,Grilled Chicken Caesar Salad,chicken,"['lemon', 'skinless', 'chicken', 'thighs', 'crusty', 'baguette', 'heads', 'lettuce', 'hearts', 'caesar']",10,15,"['salad', 'grill', 'chicken']","1/4 cup olive oil,Zest of one lemon,2 cloves garlic, finely minced,1/2 teaspoon salt,1/2 teaspoon fresh ground black pepper,1 pound boneless skinless chicken thighs,2 tablespoons olive oil,1 clove garlic, minced,1/2 teaspoon salt,1/2 teaspoon fresh ground black pepper,1 loaf crusty baguette, cut into slices about 1/2-inch thick,4 heads romaine lettuce hearts,Heaping 1/2 cup (2 ounces) Parmesan, thinly shaved,Fresh cracked black pepper,1/2 cup Caesar dressing, store-bought or ,, or more as needed",4 main course servings,,,"Chicken Caesar salad is such an easy, fuss-free weeknight meal. Add some smoky summertime flavor by grilling the chicken and the bread croutons! "
375,Sheryl Julian,Maple-Glazed Chicken with Caramelized Onions and Pears,chicken,"['skinless', 'boneless', 'chicken', 'breasts', 'plus', 'onion', 'ripe', 'pears', 'pears', 'syrup']",15,45,"['dinner', '1-pot', 'gluten-free', 'chicken']","4 skinless, boneless chicken breasts (1 1/2 to 2 pounds total),1 teaspoon salt, divided, plus more to taste,1/2 teaspoon ground black pepper, divided, plus more to taste,2 tablespoons olive oil,2 tablespoons butter,1 large Spanish or yellow onion, halved and thinly sliced,2 large ripe firm-fleshed pears (like Bartlett), or 3 smaller pears,2 tablespoons maple syrup,1 tablespoon Dijon mustard,3 tablespoons chopped fresh parsley",4 servings,5,3.0,Maple-Glazed Chicken with Caramelized Onions and Pears! A one-skillet dinner you can serve right from the pan. A little mustard in the glaze gives the chicken some zing.
376,Elise Bauer,Spicy Orange Marinated Chicken,chicken,"['orange', 'juice', 'oranges', 'oranges', 'onion', 'chipotle', 'chili', 'peppers', 'marjoram', 'skinless', 'chicken', 'bone', 'orange']",20,20,"['dinner', 'gluten-free', 'chicken thigh', 'orange']","2 cups freshly squeezed orange juice from 3 to 4 large navel oranges, or 6 small oranges, peeled and chopped,1 onion, chopped (about 1 1/2 cups),1/2 of a 7-ounce-can of chipotle chili peppers in adobo (3 1/2 ounces total),3 cloves garlic, chopped,1/3 cup chopped fresh cilantro,1 tablespoon fresh rosemary leaves, chopped (or 1 teaspoon dried),1 Tbsp fresh thyme leaves (or 1 teaspoon dried),1 Tbsp fresh marjoram or oregano leaves, or 1 teaspoon dried of either,1 teaspoon salt,2 tablespoons extra virgin olive oil,3 pounds boneless skinless chicken thighs (4 pounds if buying bone-in),Chopped fresh cilantro or parsley and orange slices for garnish",Serves 6,5,4.0,"Chicken thighs, pounded thin, marinated in mixture of orange juice, onion, garlic, herbs, and chipotle, then quickly pan fried. Delicious!"
377,Coco Morante,Skillet Chicken with Baby Bok Choy,chicken,"['chicken', 'tamari', 'corn', 'starch', 'chicken', 'breast', 'cutlets', 'fillets', 'heads', 'choy']",10,20,"['dinner', '1-pot', 'gluten-free']","1 cup chicken broth,1 1/2 tablespoons soy sauce (or tamari, if gluten-free),1 tablespoon corn starch,1 pound chicken breast cutlets or fillets,2 tablespoons olive oil, divided,1 pound (6 to 8 small heads) baby bok choy, halved lengthwise,2 cloves garlic, chopped,1 teaspoon sesame seeds (optional)",4 servings,5,2.0,"Chicken cutlets and baby bok choy make a super fast and easy weeknight meal. 30 minutes, start to finish. Cooks all in one pan, so minimal clean up."
378,Sally Vargas,Grilled Chicken Satay with Peanut Sauce,chicken,"['rice', 'lime', 'juice', 'sriracha', 'boneless', 'chicken', 'thighs', 'grill', 'scallions', 'chunky', 'peanut', 'hoisin', 'sriracha', 'lime', 'juice', 'rice', 'cucumbers', 'greens', 'arugula']",20,8,"['appetizer', 'chicken', 'skewer']","1/2 cup brown sugar,1/4 cup unseasoned rice vinegar,1/4 cup lime juice,1/4 cup ,2 tablespoons Sriracha,2 tablespoons finely chopped peeled fresh ginger,1 1/2 pounds skinless, boneless chicken breasts or thighs, cut into 1 1/2-inch-wide strips,Vegetable oil, for the grill,1 tablespoon vegetable oil,1 bunch scallions, finely chopped, including some of the green part,3 tablespoons chunky peanut butter, preferably all-natural and sugar-free,3 tablespoons hoisin sauce,1 tablespoon sriracha, or to taste,1/4 cup lime juice,1/3 to 1/2 cup water,Rice,Sliced cucumbers,Fresh pungent greens such as Thai basil or arugula","4 main course, or 8 appetizer",5,1.0,"Make your own homemade chicken satay, a popular Southeast Asian street food (and restaurant appetizer here in the States!), at home with a delicious marinade! Give it a quick turn on the grill and it's ready in just minutes. "
379,Lisa Lin,BBQ Chicken Burrito Bowl,chicken,"['tomato', 'apple', 'cider', 'honey', 'maple', 'syrup', 'chicken', 'breasts', 'chicken', 'chicken', 'broth', 'chicken', 'rice', 'substitute', 'corn', 'kernels', 'beans', 'romaine', 'lettuce', 'salsa', 'cheddar', 'monterey', 'jack', 'tortilla', 'chips']",15,10,"['dinner', 'bbq', 'gluten-free', 'chicken breast']","1 cup ketchup,1/2 cup tomato sauce,2 tablespoons distilled white vinegar (apple cider vinegar also works),2 tablespoons Worcestershire sauce,1 tablespoon honey (light brown sugar or maple syrup also works),2 1/2 teaspoons paprika,1/2 teaspoon granulated garlic,1/2 teaspoon salt,1/4 teaspoon ground cumin,1 pound (450g) chicken breasts (or substitute 2 cups cooked, shredded chicken),4 cups chicken broth or water, for cooking the chicken,1 cup uncooked brown rice (or substitute 3 cups cooked rice),1 1/4 cup fresh or frozen corn kernels,1 15-ounce (425g) can black beans, drained and rinsed,6 to 8 romaine lettuce leaves, chopped into strips,1 cup , or your favorite salsa,1 cup shredded cheddar or monterey jack cheese, optional,Crushed tortilla chips, for topping",4 servings,,,"Make-ahead BBQ Chicken Burrito Bowl with corn, black beans, and pico de gallo. Great for lunch or dinner during busy weeks!"
380,Elise Bauer,Herbed Chicken Tenders with Tomato Sauce,chicken,"['chicken', 'tenders', 'breadcrumbs', 'herbs', 'onion', 'tomato', 'tomato', 'tomatoes']",10,25,"['appetizer', 'dinner', 'italian', 'chicken breast']","2 pounds chicken tenders (about 12 pieces),1 1/2 cups buttermilk (See Recipe Note),1 cup breadcrumbs,2 tablespoons Italian seasoning herbs (See Recipe Note),1/2 teaspoon salt,2 tablespoons butter, melted,2 tablespoons extra virgin olive oil,1/4 cup minced onion,1 chopped garlic clove,1 tablespoons tomato paste,1 15-ounce can tomato sauce or crushed tomatoes,1 teaspoon salt,1 teaspoon sugar",Serves 4 to 6,5,6.0,"Chicken tenders, baked with an herbed breadcrumb coating, served with simple Italian tomato dipping sauce."
381,Elise Bauer,Red Chile Marinated Grilled Chicken,chicken,"['bone', 'skin', 'chicken', 'parts', 'thighs', 'mexican', 'chili', 'chili', 'ingredients', 'makers', 'wheat', 'products', 'cider', 'allspice', 'couple', 'grinder', 'avocado', 'cabbage', 'radishes']",10,60,"['mexican and tex mex', 'paleo', 'chicken thigh', 'grilled chicken']","3 pounds bone-in, skin-on chicken parts, preferably thighs, trimmed of excess skin and fat,Salt,1 1/4 cup Mexican red chili sauce, either ,* or canned (if you are gluten intolerant and are using canned chili sauce, make sure to read the ingredients on the can, some makers put wheat products in their sauce),1 tablespoon extra virgin olive oil,2 tablespoons white or cider vinegar,1/2 teaspoon ground cloves,1/2 teaspoon ground allspice,1 teaspoon cinnamon,1/4 teaspoon ground cumin,A couple of turns on a black pepper grinder,A pinch of dried oregano, crushed,1 teaspoon minced garlic,Avocado slices,Thinly sliced lettuce or cabbage,Thinly sliced radishes,Cilantro",Serves 4-6,5,6.0,"Chicken pieces marinated in a spicy, flavorful red chili sauce, then grilled or baked.  Pollo adobado recipe."
382,Elise Bauer,Mediterranean Chicken Salad,chicken,"['onion', 'wine', 'boneless', 'skinless', 'chicken', 'capers', 'olives', 'chile', 'lettuce', 'appetizer', 'boats', 'lettuce', 'lettuce', 'pasta', 'batch', 'salad', 'pasta', 'option']",10,25,"['make-ahead', 'mediterranean', 'chicken salad']","1/2 cup minced red onion,2 tablespoons red wine vinegar,1 pound boneless, skinless chicken breasts,Salt,2 tablespoons extra virgin olive oil,1 tablespoon capers,3/4 cup mixed pitted deli olives, sliced,1 pinch of red chile flakes,1 tablespoon chopped fresh oregano or basil (or both!),2 tablespoons chopped fresh parsley,Black pepper to taste,Endive lettuce for appetizer boats, or chopped to add to the salad,Butter lettuce for lettuce cups,Fusilli pasta, about 1/4 pound dry for one batch of the salad (use gluten-free pasta for gluten-free option)",Serves 4,5,6.0,"Easy, healthy Mediterranean style chicken salad! With olive oil, vinegar, olives, capers, onions and fresh herbs."
383,Sheryl Julian,Sheet Pan Chicken with Asparagus and Potatoes,chicken,"['potatoes', 'onions', 'walla', 'walla', 'roots', 'onion', 'lemon', 'herb', 'marjoram', 'bone', 'chicken', 'breast', 'halves', 'chicken', 'thighs', 'drumsticks', 'drumsticks']",20,90,"['family-friendly', 'dinner', '1-pot', 'gluten-free', 'chicken']","16 small new potatoes (red or golden), halved,3 small sweet onions (such as Vidalia or Walla Walla), quartered through the roots; or 1 large super sweet onion, cut into thin wedges,1 medium lemon, very thinly sliced,Large handful fresh lemon thyme or other fresh herb (oregano, marjoram, or thyme).,5 tablespoons olive oil,1 teaspoon salt, or more to taste,1/2 teaspoon black pepper, or more to taste,2 large bone-in chicken breast halves (1 1/2 pounds, 680 g),2 whole chicken legs, thighs and drumsticks attached; or 2 legs and 2 drumsticks (1/2 pounds, 227 g),1 bunch (1 pound) fresh asparagus",4 servings,5,2.0,Sheet pan chicken with asparagus and potatoes to celebrate spring! Everything cooks together until tender. Really easy and only one pan to clean!
384,Sabrina Modelle,Crispy Curried Chicken Thighs with Wilted Greens,chicken,"['bone', 'skin', 'chicken', 'thighs', 'curry', 'foods', 'onion', 'wise', 'chicken', 'broth', 'greens', 'beet', 'greens', 'baby', 'spinach', 'arugula', 'herbs', 'onions', 'herbs', 'onion']",5,25,"['dinner', 'gluten-free', 'paleo', 'chicken']","6 bone-in skin-on chicken thighs (about 2 pounds),2 tablespoons curry powder (I used a Vindaloo Powder from Frontier Foods),1/2 teaspoon salt,1/2 teaspoon pepper,1 tablespoon olive oil,1 tablespoon olive oil,1/2 yellow onion sliced thinly length-wise,2-inch piece of ginger, peeled and minced (about 1 tablespoon),2 cloves garlic, finely minced,1/3 cup chicken broth or water,6 to 8 cups of greens (like beet greens, kale, chard, baby spinach, arugula, or any combination),Lemon wedges, to serve (optional),Fresh chopped herbs, like cilantro or parsley, to garnish (optional),Sliced green onions, to garnish (optional),Chopped fresh herbs,Green onion",4 to 6 servings,5,6.0,Crispy curried chicken thighs! Serve with quick-sautéed onions and wilted greens. Easy 30 minute meal. Gluten-free and paleo.
385,Emma Christensen,How to Spatchcock (Butterfly) a Chicken,chicken,['chicken'],5,45,"['tips', 'how to', 'chicken']",1 whole chicken,"4 or more servings, depending on the size of the bird",5,1.0,"Ever spatchcocked a chicken? It's easier than you might think! It's the same method as butterflying a chicken, and you only need a pair of kitchen shears. Makes for more evenly cooked chicken with crispier skin!"
386,Elise Bauer,Chicken with Goat Cheese and Arugula,chicken,"['chicken', 'breasts', 'tenders', 'breasts', 'arugula', 'goat', 'cheese', 'wooden', 'toothpicks']",15,15,"['quick and easy', 'gluten-free', 'low carb', 'chicken breast']","4 chicken breasts (about 1 1/2 lbs total), tenders removed, breasts pounded thin,Salt,Ground black pepper,1 large bunch arugula (about 4 ounces, trimmed),4 oz of soft goat cheese (chevre) broken into small pieces,1-2 tablespoons butter or extra virgin olive oil,Wooden Toothpicks",Serves 4,5,11.0,"Skinless, boneless chicken breasts, pounded thin, wrapped around an arugula and goat cheese stuffing and roasted."
387,Elise Bauer,Ricotta Stuffed Chicken,chicken,"['chicken', 'ricotta', 'cheese', 'egg', 'tarragon', 'tarragon', 'paprika']",20,60,"['grill', 'gluten-free', 'low carb', 'roast chicken']","1 whole roasting chicken, 4 to 5 lbs.,12 oz. ricotta cheese,1/3 cup grated Parmesan cheese,1 egg,2 teaspoons chopped fresh basil (or 1 teaspoon dried),1 teaspoon chopped fresh tarragon (or 1/2 teaspoon dried),2 Tbsp chopped fresh parsley,1 large clove garlic, minced,Salt,Extra virgin olive oil,1 teaspoon chopped fresh basil (or 1/2 teaspoon dried),1/2 teaspoon chopped fresh tarragon (or 1/4 teaspoon dried),1/4 teaspoon paprika",Serves 4 to 6,5,1.0,"Butterflied chicken stuffed with ricotta, Parmesan and herbs, then grilled or baked."
388,Elise Bauer,Chipotle Salsa Baked Chicken,chicken,"['fire', 'tomatoes', 'tomatoes', 'onion', 'chili', 'peppers', 'juice', 'boneless', 'skinless', 'chicken', 'thighs', 'monterey', 'jack', 'corn', 'flour', 'tortillas', 'rice', 'pasta']",10,35,"['dinner', 'texmex', 'gluten-free', 'low carb']","1 15-ounce can fire roasted tomatoes (or canned whole or crushed tomatoes if fire roasted are not available),1/4 cup chopped red onion,1 clove garlic, chopped,1/2 cup, packed, chopped fresh cilantro,2 chipotle chili peppers in adobo, plus 1 teaspoon adobo sauce (less or more to taste),1 teaspoon lime juice,1 teaspoon kosher salt,1 1/2 pound boneless, skinless chicken breasts (or thighs), trimmed of excess fat, cut into 3-inch wide pieces,4 ounces grated or sliced Monterey jack cheese,Avocados,More chopped cilantro,Sour cream,Corn or flour tortillas,Rice,Pasta",Serves 6,5,18.0,"Chicken breasts or thighs, smothered in chipotle salsa, topped with Monterey jack cheese, and baked."
389,Coco Morante,Matzo Ball Soup,chicken,"['eggs', 'meal', 'chicken', 'carrot', 'ribs', 'celery']",15,50,"['soup and stew', 'passover', 'jewish']","2 large eggs,2 tablespoons schmaltz (chicken fat), melted, or any neutral-flavored oil,2 tablespoons water,1 teaspoon kosher salt,1/4 teaspoon ground black pepper,1/2 cup matzo meal,6 cups chicken stock, , or store-bought,1 large carrot, peeled and sliced thinly (about 1/8-inch thick),2 inner ribs of celery, peeled and sliced thinly (about 1/8-inch thick),1 tablespoon chopped fresh parsley or dill,Ground black pepper",4 servings ,,,"Homemade matzo ball soup for Passover or anytime! Fluffy matzo balls in a light, clear broth. Add chicken meat for a heartier meal."
390,Elise Bauer,Spicy Chicken Drumsticks,chicken,"['onions', 'scallions', 'parts', 'habanero', 'scotch', 'bonnet', 'chile', 'serrano', 'chilies', 'wine', 'allspice', 'pepper', 'chicken', 'dumsticks']",10,30,"['gluten-free', 'low carb', 'chicken drumstick', 'jerk']","10 green onions (scallions), white and green parts, chopped,1/2 habanero or Scotch Bonnet chile (or 3 serrano chilies), seeded and chopped,2 tablespoons white wine vinegar,1 tablespoon fresh thyme,3 cloves garlic, chopped,1 1/4 teaspoon ground allspice,1 teaspoon kosher salt, plus more for additional seasoning,1/2 teaspoon freshly ground pepper,10 chicken dumsticks (3 1/2 lbs),Extra virgin olive oil",Serves 5 to 6,,,Spicy chicken drumsticks prepared with a Carribean jerk rub and then broiled.
391,Elise Bauer,Zucchini Noodle Chicken Pesto Bowl,chicken,"['boneless', 'skinless', 'breast', 'zucchini', 'cherry', 'tomatoes']",10,20,"['favorite summer', 'gluten-free', 'low carb', 'zucchini noodle']","2 tablespoons extra virgin olive oil,1/2 pound boneless skinless chicken breast(s),Salt,1/4 teaspoon paprika,2 medium large zucchini (a little more than a pound),2 garlic cloves, sliced,1/4 cup prepared ,Handful of cherry tomatoes, cut in half,Several fresh basil leaves, thinly sliced, for garnish",Serves 2,5,2.0,"Quick and easy, sautéed zucchini noodles tossed with pesto, chicken and tomatoes. "
392,Sally Vargas,Spicy Grilled Chicken Tacos,chicken,"['orange', 'orange', 'juice', 'skinless', 'boneless', 'chicken', 'corn', 'tortillas', 'arugula', 'ripe', 'avocados', 'radishes', 'pint', 'cherry', 'tomatoes', 'onion', 'milk', 'lime']",20,15,"['dinner', 'grill', 'quick and easy', 'chicken']","2 tablespoons ,1 teaspoon dried oregano,1 teaspoon dried cumin,1 teaspoon sugar,1/2 teaspoon salt,1 clove garlic, finely chopped,1 tablespoon finely grated orange zest,3 tablespoons fresh-squeezed orange juice,2 tablespoons olive oil,4 to 6 skinless, boneless chicken thighs (1 1/4 pounds),8 small corn tortillas,3 cups packed baby arugula (3 ounces),2 medium ripe avocados, sliced,4 radishes, thinly sliced,1/2 pint cherry tomatoes, halved,1/4 red onion, thinly sliced,Roughly chopped cilantro,1/2 cup sour cream thinned with 1/4 cup milk,1 lime, cut into wedges",4 to 6 servings,5,1.0,"Spicy grilled chicken tacos! Quick marinade, then grill. Ready in about 30 minutes. Great for a quick weeknight dinner, backyard cookouts, and tailgate parties. "
393,Carrie Havranek,Sheet Pan Hawaiian Chicken {New Cookbook Recipe!},chicken,"['chicken', 'breasts', 'juice', 'juice', 'bell', 'pepper', 'teapsoon', 'gluten']",5,25,"['sheet pan dinner', 'chicken']","1 pound thin-cut chicken breasts, sliced into strips,1 (20-ounce) can pineapple chunks in juice, drained and juice reserved,1 red bell pepper, seeded and cut into strips,1 tablespoon extra-virgin olive oil,1/2 teapsoon Kosher salt,1/2 teaspoon freshly ground black pepper,1/4 cup soy sauce or tamari (gluten free, if needed),1 tablespoon freshly grated ginger,, to serve",2 to 4 servings,5,2.0,"Sheet pan dinners are lifesavers for busy humans, and this Sheet Pan Hawaiian Chicken is no exception. Combine chicken, peppers, and pineapple, bake, add a soy-ginger sauce, and serve. Boom! Dinner is done. "
394,Elise Bauer,Cardamom Honey Chicken,chicken,"['honey', 'sherry', 'cardamom', 'breasts', 'whole', 'chicken', 'parts', 'pepper']",10,45,"['dinner', 'gluten-free', 'cardamom', 'chicken']","4 tablespoons honey,2 tablespoons sherry,1 teaspoon cardamom seeds, ground,1 teaspoon peppercorns, ground,4 chicken breasts, skin-on, bone-in (cut in half if large), or one whole chicken, cut into parts,2 tablespoons extra virgin olive oil,1 lemon, thinly sliced,Salt and pepper",Serves 4,5,4.0,"Roast chicken marinated first in honey, sherry, cardamom, and pepper, then browned on the stovetop and baked to doneness in the oven."
395,Sally Vargas,Turmeric and Honey-Glazed Chicken,chicken,"['turmeric', 'coriander', 'coriander', 'honey', 'onions', '½', 'pepper', 'juice', 'lemon']",10,50,"['dinner', 'chicken']","Vegetable or olive oil, for the baking dish,1 tablespoon ground turmeric,1 teaspoon ground ginger,1 teaspoon crushed coriander seed (or ground coriander),4 tablespoons honey,1 tablespoon soy sauce,2 small yellow onions, sliced,1 (3-1/2 pound) chicken, ,½ teaspoon salt,1/8 teaspoon pepper,Juice of 1 lemon (about 3 tablespoons),1 tablespoon olive oil",4 to 6 servings,5,1.0,"Make a beautiful golden roasted chicken with a glaze of honey and turmeric! Simple enough for a weeknight meal, but fancy enough for company. "
396,Elise Bauer,"Chicken, Mushrooms, and Tomatoes with Port Wine",chicken,"['chicken', 'boneless', 'breast', 'halves', 'cremini', 'mushrooms', 'port', 'wine', 'plum', 'tomatoes', 'cherry', 'tomatoes']",10,20,"['dinner', 'quick and easy', 'chicken breast']","4 chicken boneless breast halves (with skin or without),Salt and pepper to taste,6 whole cloves garlic,2 tablespoons butter,1/4 pound of cremini mushrooms, halved or quartered if large,3 tablespoons finely chopped shallots,1/4 cup Port wine,4 small (3/4 pound) plum tomatoes, cored and quartered, or 3/4 pound cherry tomatoes, cut in half (about 2 cups),2 tablespoons chopped parsley (for garnish)",Serves 4,5,9.0,"Pan-cooked boneless, skinless, chicken breasts, with mushrooms, fresh tomatoes, and port wine."
397,Sally Vargas,Vietnamese-Style Sticky Chicken Skewers,chicken,"['palm', 'substitute', 'rice', 'wine', 'chili', 'sriracha', 'skinless', 'boneless', 'chicken', 'sheet', 'scallions', 'rice', 'rice', 'noodles']",20,10,"['appetizer', 'quick and easy', 'chicken']","1/2 cup palm sugar (or substitute brown sugar),1/2 cup unseasoned rice wine vinegar,1/4 cup fish sauce,1/3 to 1/2 cup chili sauce, like Sriracha, to taste,1 clove garlic, minced,2 tablespoons minced peeled fresh ginger,1 1/2 pounds skinless, boneless chicken thighs, cut into 2-inch pieces,Vegetable oil (for the baking sheet),Leaves from 1/4 bunch cilantro, for garnish,2 to 3 scallions, thinly sliced for garnish,Cooked rice or rice noodles, for serving",4 servings,5,1.0,"These Vietnamese Sticky Chicken Skewers balance all the flavors—sweet, salty, sour, and savory! Great as a party appetizer or fun weeknight meal. "
